Date,URL,Title,Text
05/18/2018:,https://archives.hud.gov//news/2018/pr18-044.cfm,HUD Withdraws Fair Housing Assessment Tool,"WASHINGTON - After a months-long technical evaluation, the U.S. Department of Housing and Urban Development (HUD) today announced that it is withdrawing a computer assessment tool originally intended to be helpful to local governments in meeting their obligations under the Fair Housing Act to 'affirmatively further fair housing.'
HUD found that rather than assisting local governments in formulating acceptable Assessments of Fair Housing (AFH), the Local Government Assessment Tool was confusing, difficult to use, and frequently produced unacceptable assessments. As a result, the Department is withdrawing the tool, plans a series of national listening sessions, and will seek public comment on the best framework for local governments to further fair housing choices in their communities (Read HUD's notice (https://www.hudexchange.info/resources/documents/FR-Notice-AFFH-Withdrawal-of-Local-Government-Assessment-Tool.pdf)).
With today's action, HUD is reaffirming its commitment to the Fair Housing Act and the law's requirement that recipients of HUD funding must affirmatively further fair housing (AFFH).
HUD's Assistant Secretary for Fair Housing and Equal Opportunity Anna Maria Farías said, ""We believe in furthering fair housing choice in our neighborhoods, but we have to help, not hinder those who have to put our rules into practice. we must make certain that our tools can facilitate the goals we all share-to build inclusive and sustainable communities free from discrimination.""
Background
In July of 2015, HUD published a regulation to equip local governments with data and tools to help them meet their long-standing fair housing obligations to affirmatively further fair housing (AFFH) in their use of HUD funds. However, HUD found convincing evidence that the Assessment of Fair Housing tool for local governments wasn't working well. In fact, more than a third of those early submitters initially failed to produce an acceptable assessment-not for lack of trying but because the assessment tool intended to help them wasn't helpful in promoting fair housing.
Consequently, last January, HUD extended the deadline for local governments to submit an Assessment of Fair Housing (AFH). In today's notice to its stakeholder community, HUD announced it found the tool to be flawed and will now review the assessment tool and its function under the AFFH regulations to make it less burdensome and more helpful in creating impactful fair housing goals.
As a result of today's notice, HUD is also withdrawing its January 5, 2018, notice that extended the deadline for submission of an Assessment of Fair Housing (AFH) by local governments (Read HUD's notice (https://www.hudexchange.info/resources/documents/FR-Notice-AFFH-Withdawal-of-Extension-Notice.pdf)).
In addition, any local government that has not yet submitted an AFH that has been accepted by HUD must conduct a robust Analysis of Impediments (AI) to fair housing choice within its jurisdiction. HUD is reminding these local governments that the legal obligation to affirmatively further fair housing remains in effect, and their AIs serve as effective fair housing planning tools. (Read HUD's notice (https://www.hudexchange.info/resources/documents/FR-Notice-AFFH-AI-Notice.pdf)).
Meanwhile, HUD's Office of Fair Housing and Equal Opportunity is offering an unprecedented level of technical assistance to local jurisdictions in the preparation of their fair housing analyses. Read more (https://www.hudexchange.info/program-support/technical-assistance/)."
05/22/2018:,https://archives.hud.gov//news/2018/pr18-045.cfm,"HUD Awards $2.6 Billion to Improve, Preserve Nation's Public Housing","WASHINGTON - To help public housing authorities make needed capital improvements to their properties, the U.S. Department of Housing and Urban Development today allocated more $2.6 billion in annual funding to housing authorities in all 50 states, as well as the District of Columbia, Guam, Puerto Rico and the U.S. Virgin Islands. See all the local grants announced today.
The grants announced today are provided through HUD's Capital Fund Program, which offers annual funding to approximately 3,100 public housing authorities to build, repair, renovate and/or modernize the public housing in their communities. These housing authorities use the funding to complete large-scale improvements such as replacing roofs or making energy-efficient upgrades to replace old plumbing and electrical systems.
To help provide residents with decent, safe and sanitary housing and respond to the growing demand for affordable rental housing, HUD uses the Rental Assistance Demonstration (RAD), a comprehensive strategy that complements the Capital Fund Program. RAD offers a long-term solution to preserve and enhance the country's affordable housing stock, including leveraging public and private funding to make critically needed improvements.
For more than 75 years, the federal government has been investing billions of dollars in developing and maintaining public housing, including providing critical support through the Capital Fund grants announced today. Nonetheless, there has been a net loss of over 135,000 public housing units since fiscal year 2000, representing an average loss of approximately 9,000 units annually.
In 2011, HUD released Capital Needs in the Public Housing Program, a third-party independent study that estimated the capital needs in the public housing stock in the U.S. The study found the nation's 1.1 million public housing units are facing an estimated $25.6 billion in large-scale repairs. Unlike routine maintenance, capital needs are extensive improvements required to make the housing decent and economically sustainable, such as replacing roofs or updating plumbing and electrical systems to increase energy efficiency.
Since Congress authorized the RAD demonstration in November of 2011, early results show it is generating significant additional capital for distressed public housing. As a result, more than 88,000 public housing units are converting to a more sustainable Section 8 financing platform, all without any additional costs to taxpayers. Public Housing Authorities and their partners have generated over $5 billion to preserve or replace distressed units and support local jobs in their communities - all without additional federal resources."
05/23/2018:,https://archives.hud.gov//news/2018/pr18-046.cfm,HUD and Census Bureau Report New Residential Sales in April 2018,"WASHINGTON - The U.S. Department of Housing and Urban Development (HUD) and the U.S. Census Bureau jointly announced the following new residential sales statistics for April 2018:

New Home Sales
Sales of new single-family houses in April 2018 were at a seasonally adjusted annual rate of 662,000. This is 1.5 percent (±11.8 percent)* below the revised March rate of 672,000 but is 11.6 percent (±23.7 percent)* above the April 2017 estimate of 593,000.
Sales Price
The median sales price of new houses sold in April 2018 was $312,400. The average sales price was $407,300.
For Sale Inventory and Months' Supply
The seasonally adjusted estimate of new houses for sale at the end of April was 300,000. This represents a supply of 5.4 months at the current sales rate.
The May report is scheduled for release on June 25, 2018.
Read more about new residential sales activity (https://www.census.gov/construction/nrs/index.html).
EXPLANATORY NOTES
In interpreting changes in the statistics in this release, note that month-to-month changes in seasonally adjusted statistics often show movements which may be irregular. It may take three months to establish an underlying trend for building permit authorizations, six months for total starts, and six months for total completions. The statistics in this release are estimated from sample surveys and are subject to sampling variability as well as nonsampling error including bias and variance from response, nonreporting, and undercoverage. Estimated relative standard errors of the most recent data are shown in the tables. Whenever a statement such as ""2.5 percent (±3.2 percent) above"" appears in the text, this indicates the range (-0.7 to +5.7 percent) in which the actual percentage change is likely to have occurred. All ranges given for percentage changes are 90 percent confidence intervals and account only for sampling variability. If a range does not contain zero, the change is statistically significant. If it does contain zero, the change is not statistically significant; that is, it is uncertain whether there was an increase or decrease. The same policies apply to the confidence intervals for percentage changes shown in the tables. On average, the preliminary seasonally adjusted estimates of total building permits, housing starts and housing completions are revised 3 percent or less. Explanations of confidence intervals and sampling variability can be found at the Census Bureau's website (https://www.census.gov/construction/nrs/how_the_data_are_collected/index.html).
* The 90 percent confidence interval includes zero. In such cases, there is insufficient statistical evidence to conclude that the actual change is different from zero."
05/23/2018:,https://archives.hud.gov//news/2018/pr18-047.cfm,Senate Confirms Brian Montgomery to Lead Federal Housing Administration,"WASHINGTON - By a vote of 74-23, the U.S. Senate today confirmed President Donald J. Trump's nomination of Brian D. Montgomery to serve as Assistant Secretary of Housing at the U.S. Department of Housing and Urban Development (HUD) and Commissioner of the Federal Housing Administration (FHA).
Montgomery's confirmation marks his second term as Assistant Secretary for Housing and FHA Commissioner at HUD. He previously held the job under President George W. Bush, staying on for six months after President Barack Obama's inauguration.
""Brian brings a wealth of housing knowledge and experience to HUD having held this position in two previous administrations, and we are excited to welcome him back to the Agency,"" said HUD Secretary Ben Carson. ""FHA's work is critical to HUD's mission of advancing sustainable homeownership opportunities and quality affordable housing for all Americans. Brian understands this better than anyone and will be ready on day one to address the challenges of today's housing market.""
""I'm honored to have the opportunity to serve with Secretary Carson and the team at HUD to further equal access to affordable rental housing and homeownership opportunities and seek solutions to restore vitality to the housing market,"" Montgomery said.
In addition to previously serving in the position, Montgomery has also held several other top positions throughout the government and housing industry, including Co-founder and Partner at the Collingwood Group, Deputy Assistant to the President from 2001 to 2003 including service as Secretary to the Cabinet from 2003 to 2005, and Board Member on the Federal Housing Finance Board, the Housing and Economic Recovery Act of 2008 Oversight Board, and NeighborWorks America Board.
Montgomery was nominated by President Trump on September 12, 2017. Today's full Senate vote comes six months after the Senate Banking, Housing and Urban Affairs Committee approved Montgomery's nomination (https://www.housingwire.com/articles/41905-senate-banking-committee-approves-brian-montgomery-to-lead-fha). The full text of his congressional testimony can be found here (https://www.banking.senate.gov/imo/media/doc/Montgomery%20Testimony%2010-26-17.pdf)."
05/24/2018:,https://archives.hud.gov//news/2018/pr18-048.cfm,HUD Charges New York Property Owners and Agents with Discriminating Against Resident with Disabilities,"WASHINGTON - The U.S. Department of Housing and Urban Development (HUD) today announced it is charging Syracuse, New York, property owners Nolo Contendere, LLC and Nolo Contendere LLC Trust, and their agents with housing discrimination for allegedly refusing to allow a woman with mental disabilities to keep an assistance animal. Read HUD's charge.
The Fair Housing Act prohibits housing providers from denying or limiting housing to persons with disabilities or from refusing to make reasonable accommodations in policies or practices. This includes denying a request for an assistance animal.
""Persons who require assistance animals in order to maintain their independence shouldn't have their requests for such accommodations unlawfully denied,"" said Anna María Farías, HUD's Assistant Secretary for Fair Housing and Equal Opportunity. ""Today's action reaffirms HUD's commitment to ensuring that housing providers meet their obligation to comply with the Fair Housing Act.""
The case came to HUD's attention when a woman with mental disabilities filed a complaint alleging that Nolo Contendere, LLC, which owns the apartment building she lives in, refused to allow her to keep an emotional support dog. HUD's charge of discrimination alleges that the woman requires the use of an assistance animal to help with her disability. After bringing the animal home, however, an agent for Nolo Contendere confronted her and allegedly gave her a choice of either getting rid of the animal or being evicted, even though she provided a letter from her primary care physician attesting to her need for the animal.
According to the charge, the woman contacted Central New York Fair Housing (CNYFH), a HUD Fair Housing Initiatives Program agency, for assistance. CNYFH contacted the agents and explained their obligations under the Fair Housing Act, but they refused to make an exception to their ""no-pets"" policy. One of the agents stated that the policy would also apply to seeing-eye dogs for blind tenants, and allegedly told the woman, ""I know you're trying to play the disability game. We're not playing it.""
""This Charge represents HUD's commitment to ensuring that housing providers offer equal opportunities to persons with disabilities looking to rent a home,"" said J. Paul Compton Jr., HUD's General Counsel.
The charge will be heard by a United States Administrative Law Judge unless any party elects for the case to be heard in federal court. If the administrative law judge finds after a hearing that discrimination has occurred, he may award damages to the complainant for her loss as a result of the discrimination. The judge may also order injunctive relief and other equitable relief, as well as payment of attorney fees. In addition, the judge may impose civil penalties in order to vindicate the public interest.
April 2018 marked the 50th anniversary of the passage of the Fair Housing Act. This year, HUD, local communities, housing advocates, and fair housing organizations across the country are conducting a variety of activities to enhance awareness of fair housing rights, highlight HUD's fair housing enforcement efforts, and end housing discrimination in the nation. For a list of activities, visit www.hud.gov/fairhousingis50.
The Fair Housing Act prohibits discrimination in housing because of race, color, religion, national origin, sex, disability and familial status. People who believe they have experienced discrimination may file a complaint by contacting HUD's Office of Fair Housing and Equal Opportunity at (800) 669-9777 (voice) or (800) 927-9275 (TTY). Housing discrimination complaints may also be filed by going to www.hud.gov/fairhousing."
05/28/2018:,https://archives.hud.gov//news/2018/pr18-049.cfm,HUD Approves Agreement Between Nevada Real Estate Companies and Applicant Resolving Claims of Disability Discrimination,"WASHINGTON - The U.S. Department of Housing and Urban Development (HUD) announced today that it has approved a Conciliation Agreement between Delta House Investments, LLC in Reno, Nevada, and Premier Realty, Inc., of Carson City, Nevada, and a prospective tenant resolving allegations that they denied the applicant's request to have an assistance animal. Read the agreement.
The Fair Housing Act requires housing providers to make reasonable accommodations in policies or practices when a person with a disability requires such accommodations, including granting waivers to ""no-pet"" policies for persons who require assistance animals. Additionally, the law makes it unlawful to make housing unavailable to any person because of a disability.
""Forcing persons with disabilities to live without the assistance animals they depend on denies them the opportunity to fully enjoy their home,"" said Anna María Farías, HUD Assistant Secretary for Fair Housing and Equal Opportunity. ""This case was resolved quickly and represents our continued commitment to protecting the rights of persons who require such accommodations and ensuring that housing providers meet their obligation to comply with the nation's fair housing laws.""
The agreement is the result of a complaint a woman filed with HUD alleging that Delta House Investments and Premier Realty denied her request to keep an assistance animal in the apartment she was attempting to rent, even though she provided documentation from her doctor attesting to her need for the animal due to her disability. According to the woman's complaint, the leasing agent told her that the owner did not allow pets because the floors had been recently upgraded to hardwood. After that interaction, the woman did not pursue the rental.
Under the terms of the agreement, respondents will pay the woman $6,000; obtain fair housing training; and adopt reasonable accommodation policies that assess requests on a timely basis and maintain records related to such requests.
April 2018 marked the 50th anniversary of the Fair Housing Act. In commemoration, HUD, local communities, housing advocates, and fair housing organizations across the country have coordinated a variety of activities to enhance awareness of fair housing rights, highlight HUD's fair housing enforcement efforts, and end housing discrimination in the nation. For a list of planned activities, go to www.hud.gov/fairhousingis50.
Persons who believe they have experienced discrimination may file a complaint by contacting HUD's Office of Fair Housing and Equal Opportunity at (800) 669-9777 (voice) or (800) 927-9275 (TTY). Housing discrimination complaints may also be filed by going to www.hud.gov/fairhousing."
05/31/2018:,https://archives.hud.gov//news/2018/pr18-050.cfm,HUD Kicks Off National Homeownership Month 2018,"WASHINGTON - June begins National Homeownership Month, a time of year when the U.S. Department of Housing and Urban Development (HUD) and others mark the importance of owning a home and the impact it has on the lives of American families, local neighborhoods and to the nation's economic health. This year's theme is National Homeownership Month 2018: Find Your Place.
President Donald J. Trump today proclaimed June 2018 National Homeownership Month (https://www.whitehouse.gov/presidential-actions/president-donald-j-trump-proclaims-june-2018-national-homeownership-month/): ""This month, we celebrate those Americans whose success and determination have helped make them homeowners. Their dedication to their families and communities, and to achieving a brighter and more secure future, is an inspiration to each person who is pursuing their own American Dream.""
""Homeownership serves as an enduring symbol of security and prosperity, and it provides many Americans with a legacy they can pass down to their children and grandchildren,"" said HUD Secretary Ben Carson. ""During National Homeownership Month, we recognize the abiding value of owning a home, and we rededicate ourselves toward helping hard-working families to find their place in the American dream.""

For generations of families, the goal of owning one's home has been essential to achieving the American dream. HUD recognizes the value of owning a home in building household wealth and is working to ensure that credit qualified borrowers can access and sustain their homes.
Since 1934, more than 47 million households purchased a home with mortgage loans insured by the Federal Housing Administration (FHA). During the housing crisis of a decade ago, FHA played a critical role in keeping affordable mortgage financing available for millions of qualified borrowers. Today, home sales are at pre-crisis levels and home prices on the rise in most parts of the country as millennials make up the largest segment of first-time homebuyers. Through FHA, and a national network of HUD-approved counseling agencies, HUD is working to make responsible homeownership a reality for millions of Americans.
Homeownership Facts:
HUD's Office of Housing Counseling (OHC) supports a nationwide network of more than 1,800 housing counseling agencies. Their mission is to provide individuals and families with the knowledge they need to obtain, sustain, and improve their housing. Read more about the benefits of housing counseling on HUD's website. To help with responsible homeownership, housing counselors provide homeowner education, pre-purchase and foreclosure prevention counseling, assistance with creating a budget and setting financial goals, fair housing information, and a host of other services. Struggling homeowners at risk of default who work with a housing counselor are more likely to get a loan modification, and are 30% less likely to face foreclosure, compared to similar owners who did not get counseled. The median wealth or net worth of a homeowner is nearly $200,000 or 36 times greater that of the median renter who had just over $5,000. Homeowners move far less frequently than renters, making it easier to build community networks and support systems. Children of families who own their homes are more likely to graduate high school and earn more income later in life. Last year alone, more than 1.2 million people turned to FHA to help them buy a home or to refinance into a lower cost mortgage. Today, an estimated 40 percent of all borrowers turn to FHA to purchase their first home. 44 percent of home purchases by African American families and 43 percent of home purchases by Hispanic families are assisted by FHA.
• HUD's Office of Housing Counseling (OHC) supports a nationwide network of more than 1,800 housing counseling agencies. Their mission is to provide individuals and families with the knowledge they need to obtain, sustain, and improve their housing. Read more about the benefits of housing counseling on HUD's website.
• To help with responsible homeownership, housing counselors provide homeowner education, pre-purchase and foreclosure prevention counseling, assistance with creating a budget and setting financial goals, fair housing information, and a host of other services.
• Struggling homeowners at risk of default who work with a housing counselor are more likely to get a loan modification, and are 30% less likely to face foreclosure, compared to similar owners who did not get counseled.
• The median wealth or net worth of a homeowner is nearly $200,000 or 36 times greater that of the median renter who had just over $5,000.
• Homeowners move far less frequently than renters, making it easier to build community networks and support systems.
• Children of families who own their homes are more likely to graduate high school and earn more income later in life.
• Last year alone, more than 1.2 million people turned to FHA to help them buy a home or to refinance into a lower cost mortgage.
• Today, an estimated 40 percent of all borrowers turn to FHA to purchase their first home.
• 44 percent of home purchases by African American families and 43 percent of home purchases by Hispanic families are assisted by FHA."
