Date,URL,Title,Text
"Friday, June 28, 2024",https://www.hud.gov/press/press_releases_media_advisories/HUD_No_24_164,HUD Launches New Resources and Research to Support LGBTQI+ Americans During Pride Month,"WASHINGTON - During this Pride Month, the U.S. Department of Housing and Urban Development (HUD) took action to protect LGBTQI+ Americans, taking crucial steps to uplift resources and best practices for housing providers, so no one must choose between being housed and feeling welcomed. This strategy is a collaboration between HUD’s Offices of Community Planning and Development, Fair Housing and Equal Opportunity, Public and Indian Housing, Housing, and Policy Development and Research, demonstrating HUD’s united commitment to reducing barriers and protecting LGBTQI+ Americans. “Having stable housing is essential to the foundation upon which individuals can build a better future and thrive,” said HUD Acting Secretary Adrianne Todman. “This Pride Month, HUD has taken important measures to ensure LGBTQI+ individuals have the resources they need to find affordable housing and support in their communities.” On June 25, HUD released a PD&R Edge article that identifies barriers LGBTQI+ homeless youth and young adults (YYA) face when accessing shelter and stable housing, as well as best practices providers could take to support this population. Homelessness is a persistent and growing problem which disproportionately affects LGBTQI+ youth. In 2023, approximately 8,000 unsheltered individuals identified as transgender, a gender that is not singularly female or male, or gender questioning according to HUD’s Annual Homelessness Assessment Report. The article draws on more than six months of listening sessions with approximately 30 LGBTQI+ youth and 45 service providers across five metro areas. LGBTQI+ youth and young adults voiced the need for youth-focused affirming shelter spaces, trauma informed and culturally competent practices, sustained care and service continuity even after finding permanent housing, and more education on how to report instances of discrimination. “Today’s young adults are tomorrow’s adults and too many have been left behind, unsheltered and victimized by housing discrimination,” said Demetria McCain, Principal Deputy Assistant Secretary for Fair Housing and Equal Opportunity. “A healthy society is one that takes care of its most vulnerable which HUD strives to do.” “Over the past few months, the HUD team has met with LGBTQI+ youth and young adults and service providers in Atlanta, Memphis, Dallas, Prince George’s County, and New York City where they talked with us frankly about their unique needs,” said Marion McFadden, Principal Deputy Assistant Secretary McFadden for Community Planning and Development. “They should be focused on building their futures but instead are struggling to keep a roof over their heads. Everyone seeking support in hard times deserves respect, so I am grateful to those who articulated ways to improve our programs.” This is not all – HUD also released another PD&R Edge article, which discusses actions to gather and safeguard data and support LGBTQI+ Americans. Since publishing the Sexual Orientation and Gender Identity (SOGI) Data Action Plan in March 2023, HUD has made considerable progress in collecting, planning, and coordinating data, furthering HUD’s goal to support underserved communities, ensure LGBTQI+ Americans have fair and equal access to housing, and provide access to quality, affordable homes for all. “HUD’s SOGI Data Action Plan demonstrates the agency’s commitment and plans to assess, improve, and monitor the health and well-being of LGBTQI+ Americans over time. These data are crucial for developing effective strategies that address the specific challenges that LGBTQI+ individuals face,” said Solomon Greene, Principal Deputy Assistant Secretary Solomon Greene for Policy Development and Research. “We are committed to integrating these insights and implementing equitable data collection in our research and policy development.” Additionally, HUD launched a new website that consolidates resources for the LGBTQI+ community. This new resource contains information for shelters and housing providers on how to comply with laws and regulations protecting LGBTQI+ Americans from discrimination and provide services in an inclusive manner. The website also directs LGBTQI+ people who believe they have experienced housing discrimination to file a complaint. In addition, the website assists individuals with finding assistance and shelter and links to important research that has been done on the housing needs of the LGBTQI+ community. These actions are only the latest effort in HUD’s continued work to address homelessness and provide access to affordable housing for LGBTQI+ Americans. For additional information on how the Biden-Harris Administration is supporting the LGBTQI+ community, please see the White House Fact Sheet on actions across the federal government. ### HUD's mission is to create strong, sustainable, inclusive communities and quality affordable homes for all. More information about HUD and its programs is available at www.hud.gov and https://espanol.hud.gov. You can also follow HUD on Twitter and Facebook or sign up for news alerts on HUD's Email List. Learn More About HUD's Property Appraisal and Valuation Equity Work"
"Friday, June 28, 2024",https://www.hud.gov/press/press_releases_media_advisories/HUD_No_24_163,HUD Awards $26 Million to Address the HIV Epidemic through Housing,"WASHINGTON - Today, the U.S. Department of Housing and Urban Development (HUD) awarded $26 million in Housing Interventions to End the HIV Epidemic program funding. This funding will go to 11 communities across the nation. Grantees receive a one-time award to fund housing assistance and supportive services for eligible individuals and families, coordination and planning activities, grants management and administration. HUD Principal Deputy Assistant Secretary for Community Planning and Development Marion McFadden made the announcement alongside local leaders from Volunteers of America in Los Angeles, CA. “HUD is addressing homelessness and housing instability for the populations most impacted by the HIV epidemic,” said HUD Acting Secretary Adrianne Todman. “This funding will provide grantees and their stakeholders the opportunity to complement local efforts to end the HIV epidemic.” The Housing Interventions (HINT) to End the HIV Epidemic program is part of the Housing Opportunities for Persons with AIDS (HOPWA) program. Unlike the majority of HOPWA funding, which is distributed through annual formula allocations, HINT is a competitive award aimed at promoting best practices in the field. “Earlier this year, HUD provided $455 million to 130 grantees through the HOPWA program to connect people with HIV/AIDS to housing and support,” said Principal Deputy Assistant Secretary McFadden. “The awards announced today allow communities to continue driving forward best practices and sharing successes with the field.” Each awarded project will: Use Housing First principles to provide housing and services to low-income people with HIV and their families Align with new or existing local initiatives to end the HIV epidemic by promoting housing as a key strategy Improve use of available community resources and coordination among local housing and service providers Increase the amount of quality data collected and used for decision making with an emphasis on stable housing, positive health outcomes, and equity Assess and document replicable practices that ensure equitable access and cultural humility in providing housing and services for populations of people with HIV experiencing service gaps Prioritize sustainable, effective, and equitable approaches to providing housing and services to people with HIV and their families that can be continued past the funded project’s period of performance By the end of the grant period, each grantee will create a HOPWA Special Projects of National Significance (SPNS) Grant Model. This model will showcase effective practices and lessons learned in using housing to combat the HIV epidemic. These models will be shared publicly, and the insights gained will help shape national and community policies and actions. HUD joins its federal colleagues in efforts to end the HIV epidemic by contributing to action items and efforts in the National HIV/AIDS Strategy and the Ending the HIV Epidemic initiative through these HOPWA HINT SPNS grants. Housing Opportunities for Persons with AIDS (HOPWA) Competitive Grant: Housing Interventions (HINT) to End the HIV Epidemic Awardees ### HUD's mission is to create strong, sustainable, inclusive communities and quality affordable homes for all. More information about HUD and its programs is available at www.hud.gov and https://espanol.hud.gov. You can also follow HUD on Twitter and Facebook or sign up for news alerts on HUD's Email List. Learn More About HUD's Property Appraisal and Valuation Equity Work"
"Thursday, June 27, 2024",https://www.hud.gov/press/press_releases_media_advisories/HUD_No_24_162,The Federal Housing Administration Celebrates 90 Years of Making Homeownership Possible for American Families,"June 27, 2024, marks the 90th anniversary of the creation of the Federal Housing Administration under the National Housing Act WASHINGTON - Today, the Federal Housing Administration (FHA) is recognizing the 90th anniversary of its creation under the National Housing Act of 1934, which was signed by President Franklin Delano Roosevelt. HUD celebrated today’s anniversary with an event at its Washington D.C. Headquarters, which included opening remarks by HUD Acting Secretary Adrianne Todman and Federal Housing Commissioner Julia Gordon. Attendees included past FHA Commissioners and leaders from the housing finance and advocacy communities. “The Federal Housing Administration has provided a path to homeownership for millions of people, and changed their families lives for generations to come,” said HUD Acting Secretary Adrianne Todman. “Under the Biden-Harris Administration, we are ensuring that FHA is accessible to everyone, particularly first-time homebuyers and people we have provided with fair access to homeownership in the past.” “FHA’s 90th anniversary is an opportunity to reflect on both the successes and challenges of the program throughout its nine decades, and to celebrate the enduring value FHA offers to this nation’s first-time homebuyers, borrowers of color, and underserved communities,” said Federal Housing Commissioner Julia Gordon. “As one of the first public-private partnerships, FHA has a rich history of supporting the nation’s housing system in all market conditions and making homeownership possible for those not adequately served by the private market.” FHA is the largest mortgage insurer in the world, serving a higher percentage of first-time home buyers, low- and moderate-income households, and people of color than any other mortgage channel. More than 91 million of the nation’s low- and moderate-income and first-time homebuyers have benefitted from FHA’s affordable mortgage financing since its creation, using FHA programs to build generational wealth through homeownership. More than seven million American households currently live in a home financed by an FHA-insured mortgage. On the commercial side, FHA currently insures more than 11,000 multifamily mortgages, which provide rental homes for more than 1.4 million individuals and families, as well as and more than 3,700 residential care and hospital facilities, which support access to quality healthcare in both rural and urban communities. Under the Biden-Harris Administration, FHA has made significant changes to the program to overcome barriers to homeownership, to increase the availability of affordable rental housing, and to support quality health care facilities. For example, under this Administration, FHA has: Served more than 3.4 million homebuyers and renters: Since 2021, FHA has served more than 2.9 million homebuyers, the vast majority of whom were buying a home for the first time, while also financing the rental homes of more than half a million individuals and families. Reduced costs for homebuyers: FHA cut its Single Family annual mortgage insurance premium by 35 percent in March 2023. From its implementation through May 2024, this reduction has saved more than 920,000 borrowers, an average of more than $885 per year. Together, these borrowers are saving more than $814 million through May 2024. Helped senior homeowners to age in place: Through its Home Equity Conversion Mortgage program, FHA helped more than 164,000 senior homeowners aged 62 or older to age in place. Supported greater access to quality healthcare: Under its Residential Care Facility and Hospital mortgage insurance programs, FHA insured more than 840 mortgages for nursing homes, assisted living facilities, board and care homes, and acute care hospitals throughout the nation. Removed barriers to homeownership: FHA increased access to homeownership for borrowers with student loan debt, those seeking to purchase manufactured homes or properties with Accessory Dwelling Units, and households with a strong history of on-time rental payments. Helped combat appraisal bias: FHA participated in HUD’s Property Appraisal and Valuation Equity Interagency Task Force and made sure that all its lenders implemented a clear process for borrowers to raise concerns about inaccurate appraisals, including improper racial bias. Assisted borrowers in avoiding foreclosure: Through its special COVID-19 forbearance and loss mitigation home retention options, including its new Payment Supplement Partial Claim, FHA helped two million homeowners to stay in their homes and/or otherwise avoid foreclosure through the period of the Covid pandemic. Supported financing of manufactured home communities: FHA has made cooperatives, non-profit entities and consortia, state and local governments, community development financing institutions, and Indian Tribes eligible to use FHA-insured multifamily loans to finance the acquisition of manufactured home communities. Implemented flexibilities to support affordable rental housing development: FHA made financing for the development of new affordable rental housing more accessible by increasing the large loan limit threshold for FHA-insured multifamily mortgages and restarting and extending indefinitely a risk sharing program with housing finance agencies and the U.S. Department of the Treasury’s Federal Financing Bank. Supported energy efficiency and climate resilience measures for assisted housing programs. Through its Green and Resilient Retrofit Program (GRRP), funded under the President’s Inflation Reduction Act, HUD has awarded more than $754 million in grants and surplus cash loans as of June 25, 2024. These grants and loans will help finance energy efficiency and climate resilience measures at 139 properties participating in HUD assisted housing programs, many of which also have FHA-insured mortgages, and containing more than 16,400 rental homes for low- and moderate-income individuals and families. Furthered energy efficiency measures in residential care facilities: FHA extended its successful Multifamily Green Mortgage Insurance Premium to its Residential Care Facility mortgage insurance program, providing cost savings to facilities that meet industry-recognized energy efficiency standards. Key Events in FHA’s History June 27, 1934: The 1934 National Housing Act was signed into law by President Franklin Delano Roosevelt, fundamentally changing the federal government’s role in housing and creating the Federal Housing Administration. 1940: FHA began paying all of its expenses from generated income. 1947: FHA began its insurance program for manufactured housing. 1950: The Housing Act of 1950 amended the National Housing Act to encourage the production of housing for middle-income families and established Section 213 for mortgage insurance on cooperative housing projects. 1959: FHA began its Section 232 program to insure mortgages for residential care facilities, including nursing homes. 1961: The Housing Act of 1961 authorized FHA’s Multifamily Section 221(d)(3) below market interest rate housing program for low-income rental housing. 1962: President John F. Kennedy issued Executive Order 11063, directing federal agencies to combat all form of racial discrimination and segregation in federal housing, which discontinued FHA’s reliance on racially discriminatory redlining. 1968: The Housing and Urban Development Act of 1968 established Section 236 for the production of low-cost rental housing, and Section 242, which supported capital financing for hospitals. The 1968 Act also authorized the creation of a HUD Housing Counseling Program to administer a program for housing counseling agencies to provide counseling services to renters, homebuyers, and homeowners. 1974: The Multifamily Section 223(f) refinancing program began, which insured mortgages loans for the purchase or refinancing of existing multifamily properties with or without requiring substantial rehabilitation. 1987: The Housing and Community Development Act of 1987 established the Home Equity Conversion Mortgage (HECM) reverse mortgage program that allowed elderly homeowners to borrow against their home’s equity as a means to age in place. 2008: The Housing and Economic Recovery Act (HERA) included the FHA Modernization Act which provided reforms to streamline and expand FHA’s loan programs. During the 2008 economic crisis, FHA played a vital part in supporting the nation’s housing market, demonstrating to a degree it never had before its countercyclical role in the housing market and providing continued access to mortgage financing for qualified borrowers amid severely constricted lending conditions. During the 2008 economic crisis, FHA played a vital part in supporting the nation’s housing market, demonstrating to a degree it never had before its countercyclical role in the housing market and providing continued access to mortgage financing for qualified borrowers amid severely constricted lending conditions. 2010: The Dodd-Frank Act established the HUD Office of Housing Counseling as a separate office reporting to the Assistant Secretary for Housing and Federal Housing Commissioner. 2021: FHA developed the COVID-19 Loss Mitigation waterfall that provided millions of FHA borrowers struggling financially because of the pandemic with new options to avoid foreclosure and retain their homes. ### HUD's mission is to create strong, sustainable, inclusive communities and quality affordable homes for all. More information about HUD and its programs is available at www.hud.gov and https://espanol.hud.gov. You can also follow HUD on Twitter and Facebook or sign up for news alerts on HUD's Email List. Learn More About HUD's Property Appraisal and Valuation Equity Work"
"Thursday, June 27, 2024",https://www.hud.gov/press/press_releases_media_advisories/HUD_No_24_161,HUD and Census Bureau Report New Residential Sales in May 2024,"WASHINGTON - The U.S. Department of Housing and Urban Development (HUD) and the U.S. Census Bureau jointly announced the following new residential sales statistics for May 2024: New Home Sales Sales of new single‐family houses in May 2024 were at a seasonally adjusted annual rate of 619,000, according to estimates released jointly today by the U.S. Census Bureau and the Department of Housing and Urban Development. This is 11.3 percent (±15.5 percent)* below the revised April rate of 698,000 and is 16.5 percent (±16.2 percent) below the May 2023 estimate of 741,000. Sales Price The median sales price of new houses sold in May 2024 was $417,400. The average sales price was $520,000. For Sale Inventory and Months’ Supply The seasonally‐adjusted estimate of new houses for sale at the end of May was 481,000. This represents a supply of 9.3 months at the current sales rate. The June report is scheduled for release on July 24, 2024. View the full schedule in the Economic Briefing Room. The full text and tables for this release can be found here. EXPLANATORY NOTES These statistics are estimated from sample surveys. They are subject to sampling variability as well as nonsampling error including bias and variance from response, nonreporting, and undercoverage. Estimated average relative standard errors of the preliminary data are shown in the tables. Whenever a statement such as “2.5 percent (±3.2%) above” appears in the text, this indicates the range (‐0.7 to +5.7 percent) in which the actual percent change is likely to have occurred. All ranges given for percent changes are 90‐percent confidence intervals and account only for sampling variability. If a range does not contain zero, the change is statistically significant. If it does contain zero, the change is not statistically significant; that is, it is uncertain whether there was an increase or decrease. The same policies apply to the confidence intervals for percent changes shown in the tables. Changes in seasonally adjusted statistics often show irregular movement. It takes 3 months to establish a trend for new houses sold. Preliminary new home sales figures are subject to revision due to the survey methodology and definitions used. The survey is primarily based on a sample of houses selected from building permits. Since a “sale” is defined as a deposit taken or sales agreement signed, this can occur prior to a permit being issued. An estimate of these prior sales is included in the sales figure. On average, the preliminary seasonally adjusted estimate of total sales is revised about 3.2 percent. Changes in sales price data reflect changes in the distribution of houses by region, size, etc., as well as changes in the prices of houses with identical characteristics. Explanations of confidence intervals and sampling variability can be found on our website. The Census Bureau has reviewed SOC monthly and quarterly tables to ensure appropriate access, use, and disclosure avoidance protection of the confidential source data (Disclosure Review Board (DRB) approval number: CBDRBFY23‐ 0307). API The Census Bureau’s application programming interface lets developers create custom apps to reach new users and makes key demographic, socio‐economic and housing statistics more accessible than ever before. FRED Mobile App Receive the latest updates on the nation’s key economic indicators by downloading the FRED App for both Apple and Android devices. FRED, the signature database of the Federal Reserve Bank of St. Louis, now incorporates the Census Bureau’s 13 economic indicators. * The 90 percent confidence interval includes zero. In such cases, there is insufficient statistical evidence to conclude that the actual change is different from zero. ### HUD's mission is to create strong, sustainable, inclusive communities and quality affordable homes for all. More information about HUD and its programs is available at www.hud.gov and https://espanol.hud.gov. You can also follow HUD on Twitter and Facebook or sign up for news alerts on HUD's Email List. Learn More About HUD's Property Appraisal and Valuation Equity Work"
