Date,URL,Title,Text
09/21/2018:,https://archives.hud.gov//news/2018/pr18-107.cfm,HUD Approves Agreement Between California Mortgage and Appraisal Companies and Homeowners,"WASHINGTON - The U.S. Department of Housing and Urban Development (HUD) has approved a Conciliation Agreement resolving claims brought by three homeowners, a couple and an individual, against loanDepot.com, LLC, and Appraisal Management Services of America, Inc. The three alleged that the lender refused to refinance their homes because they are on Native American lands. The individual also claimed that loanDepot.com would not refinance his house because he is Native American. Read the agreement.
The Fair Housing Act prohibits housing discrimination in mortgage lending and real estate-related transactions based on race, color, national origin, religion, sex, familial status and disability.
""A homeowner's creditworthiness and ability to pay should be the only thing that matters when they apply for a mortgage, not their race or the fact that their home is located on Native American lands,"" said Anna María Farías, HUD's Assistant Secretary for Fair Housing and Equal Opportunity. ""Today's agreement sends a loud and clear message that HUD is committed to ensuring that lenders and other companies involved in the home mortgage process meet their obligations under the Fair Housing Act.""
The cases came to HUD's attention when the couple from Belcourt, North Dakota, and the homeowner from Hoopa, California, filed complaints alleging that loanDepot,com refused to refinance their homes, which they owned in fee simple but within American Indian reservations. In one case, Appraisal Management Services of America informed loanDepot.com that it could not provide an appraisal on the home because it was on ""Indian land."" LoanDepot.com and Appraisal Management Services of America deny discriminating against the three homeowners.
Under the terms of the agreement, loanDepot.com will pay the couple and the other homeowner $30,000 each and fund a loan subsidy program in the amount of $40,000 that will benefit prospective borrowers on American Indian Reservations. LoanDepot.com also will provide $240,000 to support outreach programs that improve housing conditions, teach financial literacy, and provide home ownership education to American Indians on and around reservations. In addition, loanDepot.com will revise its policies regarding the underwriting of home mortgage loans on land located within the boundaries of American Indian reservations to ensure that its policies are consistent with the requirements of the Fair Housing Act.
Appraisal Management Services of America, Inc., will revise its policies regarding appraisals for mortgages on homes located on American Indian reservations and no longer contract with appraisers who refuse to conduct appraisals on reservations.
April 2018 marked the 50th anniversary of the Fair Housing Act. In commemoration, HUD, local communities, housing advocates, and fair housing organizations across the country have coordinated a variety of activities to enhance awareness of fair housing rights, highlight HUD's fair housing enforcement efforts, and end housing discrimination in the nation. For a list of planned activities, log onto www.hud.gov/fairhousingis50.
Persons who believe they have experienced discrimination may file a complaint by contacting HUD's Office of Fair Housing and Equal Opportunity at (800) 669-9777 (voice) or (800) 927-9275 (TTY)."
09/25/2018:,https://archives.hud.gov//news/2018/pr18-108.cfm,"HUD, GSA Partner in Centers of Excellence Initiative","WASHINGTON - The U.S. Department of Housing and Urban Development (HUD) and the U.S. General Services Administration (GSA) today announced they are teaming up for a discovery sprint as part of GSA's Centers of Excellence (CoE) initiative.
The purpose of the CoE initiative is to accelerate the modernization of information technology (IT) across the federal government by leveraging private sector innovation and existing government services while centralizing best practices and expertise. By bringing the CoE model to HUD, GSA will utilize the expertise of the Technology Transformation Services (TTS) team within GSA's Federal Acquisition Service (FAS) to begin a comprehensive assessment of the IT needs and challenges facing the department.
""I'm thrilled HUD is teaming up with GSA to transform this agency into a more effective and efficient servant on behalf of the American people,"" said HUD Secretary Ben Carson. ""This is an important moment for HUD as we embark upon a campaign to modernize our aging technology and bring true financial integrity to everything we do.""
""Secretary Carson and his team are committed to utilizing the Centers of Excellence approach - and GSA's expertise - to make interactions with the American people more seamless and effective,"" said GSA Administrator Emily Murphy. ""Today's announcement further demonstrates the strength, success, and momentum that the CoEs have already brought to bear in less than a year. I couldn't be more excited to build upon the work we have begun with USDA by implementing these best practices at an agency as customer-focused and citizen-facing as HUD.""
""Applying these successful business management principles to our operations and modernizing our technology infrastructure will transform this agency,"" said HUD Chief Operating Officer Ralph Gaines. ""We thank GSA for launching this important initiative and partnering with HUD to make our federal government more accountable to taxpayers.""
""With GSA's help we will transform how HUD operates across our agency and within our programs,"" said HUD Chief Financial Officer Irv Dennis. ""This first phase will help us identify the upgrades we need to bring our technology systems and accounting procedures into the 21st century. Overall, this is a great initiative we see often in the private sector and not often enough in the federal government.""
""In partnering with GSA's CoEs, HUD's business needs are our primary focus,"" said HUD Chief Information Officer David Chow. ""This first phase of the CoEs will be led by program office experts with full IT support to streamline business processes and enhance taxpayers' overall experience.""
HUD's mission is to create strong, sustainable, inclusive communities and quality affordable homes for all. Through the CoE initiative, HUD will examine its technology infrastructure and operating procedures to identify needed upgrades and opportunities for improvement. These changes will help the agency in its goal to strengthen the housing market for people at every income level and to improve quality of life for current and future HUD program participants.
The CoE initiative was formally introduced through a Request for Information (https://www.fbo.gov/index.php?s=opportunity&mode=form&id= cca9da77bffbcb0d0a8f1b46d4cfa4ad&tab=core&tabmode=list&=) (RFI) issued on October 20, 2017. Beginning with the first lighthouse agency, United States Department of Agriculture (USDA), each CoE tackles distinct tasks, beginning with an assessment and planning phase that results in the development of a roadmap for the successful implementation of managing centralized, function-specific talent, solutions, and acquisition vehicles. They also provide for documented and scalable best-practices that can be rapidly spread to, and adopted by, other agencies throughout the government.
Following an industry day at the White House in December 2017, GSA moved quickly to finalize an Interagency Agreement with USDA and later issued solicitations for its Phase I strategy and consulting work. As part of Phase I, CoEs worked with USDA to strategize IT modernization efforts. Work will continue at USDA, with the announcement of Phase II awards expected in the coming weeks. GSA finalized its Interagency Agreement with HUD this week."
09/26/2018:,https://archives.hud.gov//news/2018/pr18-109.cfm,HUD and Census Bureau Report New Residential Sales in August 2018,"WASHINGTON - The U.S. Department of Housing and Urban Development (HUD) and the U.S. Census Bureau jointly announced the following new residential sales statistics for August 2018:

New Home Sales
Sales of new single-family houses in August 2018 were at a seasonally adjusted annual rate of 629,000. This is 3.5 percent (±13.7 percent)* above the revised July rate of 608,000 and is 12.7 percent (±20.7 percent)* above the August 2017 estimate of 558,000.
Sales Price
The median sales price of new houses sold in August 2018 was $320,200. The average sales price was $388,400.
For Sale Inventory and Months' Supply
The seasonally adjusted estimate of new houses for sale at the end of August was 318,000. This represents a supply of 6.1 months at the current sales rate.
The September report is scheduled for release on October 24, 2018.
Read more about new residential sales activity (https://www.census.gov/construction/nrs/index.html).
EXPLANATORY NOTES
In interpreting changes in the statistics in this release, note that month-to-month changes in seasonally adjusted statistics often show movements which may be irregular. It may take three months to establish an underlying trend for building permit authorizations, six months for total starts, and six months for total completions. The statistics in this release are estimated from sample surveys and are subject to sampling variability as well as nonsampling error including bias and variance from response, nonreporting, and undercoverage. Estimated relative standard errors of the most recent data are shown in the tables. Whenever a statement such as ""2.5 percent (±3.2 percent) above"" appears in the text, this indicates the range (-0.7 to +5.7 percent) in which the actual percentage change is likely to have occurred. All ranges given for percentage changes are 90 percent confidence intervals and account only for sampling variability. If a range does not contain zero, the change is statistically significant. If it does contain zero, the change is not statistically significant; that is, it is uncertain whether there was an increase or decrease. The same policies apply to the confidence intervals for percentage changes shown in the tables. On average, the preliminary seasonally adjusted estimates of total building permits, housing starts and housing completions are revised 3 percent or less. Explanations of confidence intervals and sampling variability can be found at the Census Bureau's website (https://www.census.gov/construction/nrs/how_the_data_are_collected/index.html).
* The 90 percent confidence interval includes zero. In such cases, there is insufficient statistical evidence to conclude that the actual change is different from zero."
09/27/2018:,https://archives.hud.gov//news/2018/pr18-110.cfm,HUD and U.S. Virgin Islands Sign $243 Million Disaster Recovery Grant Agreement,"WASHINGTON - U.S. Department of Housing and Urban Development (HUD) Deputy Secretary Pamela Hughes Patenaude and the U.S. Virgin Island's Governor Kenneth Mapp today announced the formal execution of a $243 million grant agreement to help citizens in the U.S. Virgin Islands to recover from Hurricanes Irma and Maria. The signing of this grant agreement now paves the way to speed recovery dollars needed to restore damaged and destroyed homes, businesses and infrastructure.
The U.S. Virgin Islands' long-term recovery is supported through HUD's Community Development Block Grant-Disaster Recovery (CDBG-DR) Program, which requires grantees to develop thoughtful recovery plans informed by local residents. Learn more about CDBG-DR and the State's role in long-term disaster recovery (https://youtu.be/Lrmwz8IXXdQ).
""Today, we take another important step in the process of rebuilding damaged homes, restoring shuttered businesses and repairing critical infrastructure,"" said Deputy Secretary Patenaude. ""With the formal execution of this grant agreement, the real brick-and-mortar recovery work can begin.""
""On behalf of the people of the Virgin Islands, I thank Secretary Carson, Deputy Secretary Patenaude and all the HUD staff for working so closely with us to finalize this grant,"" Governor Kenneth Mapp said. ""We look forward to be being able to speed up assistance to homeowners and to construct new housing for seniors and others in need. We now have the opportunity to make permanent repairs to public housing and provide assistance to private landlords as we work to rebuild our housing stock. HUD is also helping us ensure that more Virgin Islanders have the opportunity to be a part of the rebuilding process through funding training for work in the construction trades.""
To address unmet needs, the U.S. Virgin Islands identified several housing, infrastructure and economic development recovery needs arising from Hurricanes Irma and Maria. The U.S. Virgin Islands disaster recovery action plan includes the following activities:
Homeowner Rehabilitation and Reconstruction Program ($10 million) - This program is available to eligible homeowners for properties that were damaged by Hurricanes Irma or Maria.
New Construction for Homeownership Opportunity and First Time Homebuyer Assistance ($10 million) - This program is designed to address post-disaster housing affordability challenges and enable renters to become homeowners.
Rental Rehabilitation and Reconstruction ($5 million) - This program provides funds for the repair or replacement of damage to rental housing owned by the Virgin Islands Housing Authority, Virgin Islands Housing Finance Agency, and private landlords.
Public & Affordable Housing Development ($32 million) - These funds are targeted for the redevelopment and creation of new affordable housing, including subsidized and mixed-income rental units.
Supportive Housing & Sheltering Programs ($15 million) - The U.S. Virgin Islands recovery plan includes an effort for the rehabilitation, reconstruction, and development of housing for vulnerable populations, particularly among low-income seniors and those persons and families experiencing homelessness. This program also includes the development of emergency shelters for individuals and families who cannot shelter in place during disasters. The emergency shelter housing would also serve persons who require short-term housing because they are temporarily displaced.
Infrastructure ($125,549,800) - These funds are targeted for three infrastructure activities: 1) Local Match for Federal Disaster Relief Programs ($50,549,800) to help finance educational facilities, energy, hospitals, telecommunications, transportation, waste management, and water/wastewater management; 2) Infrastructure Repair and Resilience ($30,000,000) and 3) Electrical Power Systems Enhancement and Improvement ($45,000,000).
Economic Revitalization ($33 million) - Through this program, the U.S. Virgin Islands seeks to revitalize the post-disaster economy, including ($23 million) for Ports and Airports Enhancements, including harbor dredging to allow for larger cruise ships; 2) a Workforce Development Program to train low- and moderate-income residents to fill the construction and other jobs coming from recovery investments ($5,000,000); and 3) the Tourism Industry Support Program ($5,000,000), which will require a waiver by HUD, for marketing to communicate that the USVI is open for business.
Background
On September 8, 2017, President Trump signed the Additional Supplemental Appropriations for Disaster Relief Requirements Act, 2017. The Act appropriated $7.4 billion in CDBG-DR funding for major disasters declared in 2017. To distribute these funds, the Act requires HUD to direct the funds to the areas most impacted by last year's major disasters. On February 2, 2018, HUD allocated $243 million of that appropriation to the U.S. Virgin Islands to address the serious unmet needs on the islands. The action plan approved today will put these funds to work.
On April 10, 2018, HUD allocated another $1.6 billion to further support recovery in the U.S. Virgin Islands and to rebuild communities impacted by Hurricanes Maria and Irma and to protect them from major disasters in the future. HUD will shortly publish program rules to guide the U.S. Virgin Islands and others on the use of those funds.
CDBG-DR grants support a variety of disaster recovery activities including housing redevelopment and rebuilding, business assistance, economic revitalization, and infrastructure repair. Grantees are required to spend the majority of these recovery funds in ""most impacted"" areas as identified by HUD. HUD will issue administrative guidelines shortly for use of the funds to address grantees' long-term recovery needs, particularly in the area of housing recovery."
09/28/2018:,https://archives.hud.gov//news/2018/pr18-111.cfm,FHA to Require Second Appraisal for Certain Reverse Mortgages,"WASHINGTON - The Federal Housing Administration (FHA) today announced that it will begin requiring lenders originating new Home Equity Conversion Mortgages (HECMs), commonly referred to as reverse mortgages, to provide a second property appraisal under certain circumstances. FHA is instructing lenders to provide a second independent property appraisal in cases where FHA determines there may be inflated property valuations.
FHA's new requirement takes effect for case numbers assigned on or after October 1, 2018 through September 30, 2019. FHA will periodically review this guidance and, based on the results, may renew these requirements beyond fiscal year 2019. Read FHA's Mortgagee Letter.
FHA will perform a risk assessment of appraisals submitted for use in new HECM originations. Based on the outcome of that assessment, FHA may require a second appraisal be obtained prior to approving the reverse mortgage for an insurance endorsement. Under the new policy, lenders must not approve or close a HECM before FHA has performed the collateral risk assessment and, if required, a second appraisal is obtained. Where a second appraisal is required by FHA, lenders must use the lower value of the two appraisals.
The appraisal validation policy announced today will further reduce risks to FHA's Mutual Mortgage Insurance Fund (MMIF) and protect the health of the HECM program. The financial soundness of FHA's reverse mortgage program is contingent on an accurate determination of a property's value and condition. The property value is used to determine the amount of equity that is available to the borrower and it is also used by FHA to determine the amount of insurance benefits paid to a mortgagee.
In a 2017 evaluation, the U.S. Department of Housing and Urban Development (HUD) found higher-than-expected losses in the HECM program could be attributed in part to ""optimistic estimates of collateral value driven by exaggerated property appraisals when the loan was originated."" Read Reverse Mortgage Collateral: Undermaintenance or Overappraisal? (https://www.huduser.gov/portal/periodicals/cityscpe/vol19num1/ch1.pdf).
FHA is addressing the accuracy of appraised property values due to continuing volatility in the HECM program. Last year, FHA's Fiscal Year 2018 Annual Report to Congress found the agency's reverse mortgage portfolio had a negative capital ratio of 19.84 percent and a negative net worth of $14.5 billion. To begin to address the financial solvency of the program, FHA instituted several reforms to the HECM program to improve its financial health and to ensure reverse mortgages remain a resource to allow senior borrowers to remain in their homes and age in place. FHA is continuing to analyze the impact of these reforms and expects to provide an assessment in its Annual Report on the financial status of the MMIF."
10/02/2018:,https://archives.hud.gov//news/2018/pr18-112.cfm,HUD Awards $6.7 Million in Research Grants to Reduce Lead and Other Housing-Related Health Hazards,"WASHINGTON - To help protect children and seniors from exposure to lead and other home health hazards, the U.S. Department of Housing and Urban Development (HUD) today awarded $6.7 million to seven universities and public health organizations to improve methods for identifying and controlling residential health risks including lead-based paint, mold, secondhand tobacco smoke, and other indoor contaminants. Read a complete project-by-project summary of the programs awarded grants today.
The grants to states and local governments, institutions of higher education are being offered through HUD's Lead and Healthy Homes Technical Studies Grant Program. The following is a state-by-state breakdown of the grant awards announced today:
""This research will help communities create healthier home environments for families and seniors,"" said HUD Secretary Ben Carson. ""These grants not only save money but also help to prevent injuries from lead-based paint exposure and common housing-related health hazards.""
""It's critical that we continue supporting research to develop evidence-based methods that make our homes safer places to live,"" said Matt Ammon, Director of HUD's Office of Lead Hazard Control and Healthy Homes. ""We know that poor quality housing can contribute to injury and illness, which is entirely preventable.""
HUD's Office of Lead Hazard Control and Healthy Homes promotes local efforts to eliminate dangerous lead-paint and other housing-related health and safety hazards from lower income homes, stimulate private sector investment in lead hazard control, support cutting-edge research on methods for assessing and controlling housing-related health and safety hazards, and educate the public about the dangers of hazards in the home."
10/03/2018:,https://archives.hud.gov//news/2018/pr18-113.cfm,HUD and VA Secretaries Announce Housing Initiatives to Support Homeless Veterans,"WASHINGTON - U.S. Department of Housing and Urban Development (HUD) Secretary Ben Carson and U.S. Department of Veterans Affairs (VA) Secretary Robert Wilkie today joined together at the VA Community Resource and Referral Center to announce $35 million in grants to combat veteran homelessness. The funding will be provided through the HUD-Veterans Affairs Supportive Housing (HUD-VASH) Program to 212 public housing agencies across the country to provide a permanent home for over 4,000 homeless veterans.
The Secretaries also announced an additional $7.4 million through the Veterans Housing Rehabilitation and Modification Pilot (VHRMP) Program to assist disabled veterans with modifying or rehabilitating their homes, making them more accessible.
""We have few responsibilities greater than making sure those who have sacrificed so much in service to their country have a home they can call their own,"" said HUD Secretary Carson. ""The housing vouchers awarded today ensure homeless veterans nationwide have access to affordable housing and the critical support services from the VA.""
""Assisting homeless Veterans to gain access to housing helps them in every aspect of their lives,"" said VA Secretary Wilkie. ""This joint effort ensures that the federal government's efforts are aligned in reducing homelessness and aiding veterans. VA and HUD are proud to be teammates in a program that makes a tangible improvement in the lives of the nation's Veterans.""
The HUD-VASH program combines rental assistance vouchers from HUD with case management and clinical services provided by VA. Since 2008, more than 93,000 vouchers have been awarded and approximately 150,000 homeless veterans have been served through the HUD-VASH program. More than 600 public housing authorities (PHAs) administer the HUD-VASH program, and this most recent award includes 22 additional PHAs, increasing HUD-VASH coverage to more communities. See the local impact of the housing assistance announced today.
In the HUD-VASH program, VA Medical Centers (VAMCs) assess veterans experiencing homelessness before referring them to local housing agencies for these vouchers. Decisions are based on a variety of factors, most importantly the duration of homelessness and the need for long-term, intensive support in obtaining and maintaining permanent housing. The HUD-VASH program includes both the rental assistance the voucher provides and the comprehensive case management that VAMC staff offers.
Veterans participating in the HUD-VASH program rent privately owned housing and generally contribute no more than 30 percent of their income toward rent. VA offers eligible homeless veterans clinical and supportive services through its medical centers across the U.S., Guam, Puerto Rico and the Virgin Islands. Read more about the HUD-VASH program.
Through the VHRMP program, grantees will make necessary physical modifications to address the adaptive housing needs of eligible veterans, including wheelchair ramps, widening exterior and interior doors, reconfiguring and reequipping bathrooms, or adding a bedroom or bathroom for the veteran's caregiver to the home.
The purpose of this pilot program is to assist our nation's low-income veterans living with disabilities who are in need of adaptive housing to help them regain or maintain their independence. By partnering with the VA, HUD is addressing these challenges by awarding competitive grants to organizations that primarily serve veterans and low-income people.
Veterans Housing Rehabilitation and Modification Pilot Program (VHRMP) Fiscal Year 2018 Awards"
