Date,URL,Title,Text
"Friday, March 29, 2024",https://www.hud.gov/press/press_releases_media_advisories/HUD_No_24_067,HUD Announces Disaster Assistance for California Disaster Survivors,"WASHINGTON - The U.S. Department of Housing and Urban Development (HUD) today announced the implementation of federal disaster assistance for the State of California to assist supplement state, tribal and local recovery efforts in areas affected by a severe storm and flooding from January 21 to January 23, 2024. President Biden issued a major disaster declaration to affected individuals in San Diego County. Effective immediately, HUD is: Providing a 90-day moratorium on foreclosures of mortgages insured by the Federal Housing Administration (FHA) as well as foreclosures of mortgages to Native American borrowers guaranteed under the Section 184 Indian Home Loan Guarantee program. There is also a 90-day extension granted automatically for Home Equity Conversion Mortgages. The moratorium and extension are effective as of the President’s disaster declaration date. Homeowners affected by the disaster should contact their mortgage or loan servicer immediately for assistance. Conventional mortgage holders may also be eligible for additional relief through their mortgage holder. Call the FHA Resource Center at 1-800-304-9320 for additional information. To learn more about disaster relief options for FHA homeowners visit the FHA Disaster Relief site. Making mortgage insurance available - When homes are destroyed or damaged to an extent that required reconstruction or complete replacement, HUD’s Section 203(h) program provides FHA insurance to disaster victims. Borrowers from participating FHA approved lenders are eligible for 100 percent financing including closing costs. Making insurance available for both mortgage and home rehabilitation - HUD's Section 203(k) loan program also allows individuals to finance the purchase or refinance of a house along with its repair through a single mortgage. Homeowners can also finance the rehabilitation of their existing homes if damaged. Sharing information on housing providers and HUD programs - Information will be shared with FEMA and the State on housing providers that may have available units in the impacted counties, including Public Housing Agencies and Multi-Family owners. The Department will also connect FEMA and the State to subject matter experts to provide information on HUD programs and providers. Providing flexibility to Community Planning and Development Grantees - Recipients of Community Development Block Grant (CDBG) Program, Housing Opportunities for Persons With HIV/AIDS (HOPWA) Program, Continuum of Care (CoC) Program, Emergency Solutions Grants (ESG) Program, HOME Program, and Housing Trust Fund (HTF) Program funds can apply for needed administrative flexibility in response to natural disasters. For more information on applying for a waiver or suspension of program requirements, contact your local Community Planning and Development Program Office here. Providing flexibility to Public Housing Agencies - Public Housing Agencies can apply for needed waivers and flexibilities for disaster relief and recovery. For detailed information on applying for a waiver, click here for the latest Federal Register Disaster Relief Notice guidance. The Department also released PIH Notice 2021-34, which advises the public of HUD's expedited process for waivers and flexibilities from HUD regulatory and administrative requirements for various Public Housing and Voucher Programs. As a reminder, to be eligible to receive a disaster waiver, the PHA must be located in an active Presidentially declared Major Disaster Declaration area and submitted within four months of an MDD. Providing flexibility to Tribes - Tribes and their Tribally Designated Housing Entities can apply for needed administrative flexibility through regulatory waivers. For detailed information on how to apply for a waiver, Tribes and TDHEs should contact their local Office of Native American Programs or email Codetalk@hud.gov. Ensuring HUD-approved housing counseling agencies are ready to assist - HUD-approved housing counseling agencies have counselors available to assist those impacted by natural disasters to determine assistance needs and available resources. Find a HUD-approved housing counseling agency online or use our telephone look-up tool by calling (800) 569-4287. Telephone look-up includes access to information in more than 200 different languages. You do not have to have an FHA-insured mortgage to meet with a HUD-approved housing counseling agency. There is never a fee for foreclosure prevention counseling. Assisting with housing discrimination - Housing discrimination sometimes occurs when people attempt to find and access housing following a disaster. HUD's Office of Fair Housing and Equal Opportunity is available to assist people who believe they have experienced housing discrimination. If you think your rights have been violated, you should file a fair housing complaint with HUD. You can file a complaint by calling HUD at 1-800-669-9777 or visiting How to File a Complaint on HUD's website. Materials and assistance are available for persons with limited English proficiency. Individuals who are deaf or hard of hearing may contact the Department using the Federal Relay Service at 1-800-877-8339. You should file a complaint with HUD as soon as possible. HUD may not help you if your complaint is filed more than one year after the last discriminatory act. You may also be able to file a complaint with a state or local fair housing agency. A list of the state and local fair housing agencies funded by HUD is available on HUD’s website here. ### HUD's mission is to create strong, sustainable, inclusive communities and quality affordable homes for all. More information about HUD and its programs is available at www.hud.gov and https://espanol.hud.gov. You can also follow HUD on Twitter and Facebook or sign up for news alerts on HUD's Email List. Learn More About HUD's Property Appraisal and Valuation Equity Work"
"Friday, March 29, 2024",https://www.hud.gov/press/press_releases_media_advisories/HUD_No_24_066,HUD Announces Disaster Assistance for Alaska Disaster Survivors,"WASHINGTON - The U.S. Department of Housing and Urban Development (HUD) today announced the implementation of federal disaster assistance for the Wrangell Cooperative Association to assist areas in the Tribal Nation’s affected by a severe storm, landslides, and mudslides on November 20, 2023. On March 15, 2024, President Biden issued a major disaster declaration. Effective immediately, HUD is: Providing a 90-day moratorium on foreclosures of mortgages insured by the Federal Housing Administration (FHA) as well as foreclosures of mortgages to Native American borrowers guaranteed under the Section 184 Indian Home Loan Guarantee program. There is also a 90-day extension granted automatically for Home Equity Conversion Mortgages. The moratorium and extension are effective as of the President’s disaster declaration date. Homeowners affected by the disaster should contact their mortgage or loan servicer immediately for assistance. Conventional mortgage holders may also be eligible for additional relief through their mortgage holder. Call the FHA Resource Center at 1-800-304-9320 for additional information. To learn more about disaster relief options for FHA homeowners visit the FHA Disaster Relief site. Making mortgage insurance available - When homes are destroyed or damaged to an extent that required reconstruction or complete replacement, HUD’s Section 203(h) program provides FHA insurance to disaster victims. Borrowers from participating FHA approved lenders are eligible for 100 percent financing including closing costs. Making insurance available for both mortgage and home rehabilitation - HUD's Section 203(k) loan program also allows individuals to finance the purchase or refinance of a house along with its repair through a single mortgage. Homeowners can also finance the rehabilitation of their existing homes if damaged. Sharing information on housing providers and HUD programs - Information will be shared with FEMA and the State on housing providers that may have available units in the impacted counties, including Public Housing Agencies and Multi-Family owners. The Department will also connect FEMA and the State to subject matter experts to provide information on HUD programs and providers. Providing flexibility to Community Planning and Development Grantees - Recipients of Community Development Block Grant (CDBG) Program, Housing Opportunities for Persons With HIV/AIDS (HOPWA) Program, Continuum of Care (CoC) Program, Emergency Solutions Grants (ESG) Program, HOME Program, and Housing Trust Fund (HTF) Program funds can apply for needed administrative flexibility in response to natural disasters. For more information on applying for a waiver or suspension of program requirements, contact your local Community Planning and Development Program Office here. Providing flexibility to Public Housing Agencies - Public Housing Agencies can apply for needed waivers and flexibilities for disaster relief and recovery. For detailed information on applying for a waiver, click here for the latest Federal Register Disaster Relief Notice guidance. The Department also released PIH Notice 2021-34, which advises the public of HUD's expedited process for waivers and flexibilities from HUD regulatory and administrative requirements for various Public Housing and Voucher Programs. As a reminder, to be eligible to receive a disaster waiver, the PHA must be located in an active Presidentially declared Major Disaster Declaration area and submitted within four months of an MDD. Providing flexibility to Tribes - Tribes and their Tribally Designated Housing Entities can apply for needed administrative flexibility through regulatory waivers. For detailed information on how to apply for a waiver, Tribes and TDHEs should contact their local Office of Native American Programs or email Codetalk@hud.gov. Ensuring HUD-approved housing counseling agencies are ready to assist - HUD-approved housing counseling agencies have counselors available to assist those impacted by natural disasters to determine assistance needs and available resources. Find a HUD-approved housing counseling agency online or use our telephone look-up tool by calling (800) 569-4287. Telephone look-up includes access to information in more than 200 different languages. You do not have to have an FHA-insured mortgage to meet with a HUD-approved housing counseling agency. There is never a fee for foreclosure prevention counseling. Assisting with housing discrimination - Housing discrimination sometimes occurs when people attempt to find and access housing following a disaster. HUD's Office of Fair Housing and Equal Opportunity is available to assist people who believe they have experienced housing discrimination. If you think your rights have been violated, you should file a fair housing complaint with HUD. You can file a complaint by calling HUD at 1-800-669-9777 or visiting How to File a Complaint on HUD's website. Materials and assistance are available for persons with limited English proficiency. Individuals who are deaf or hard of hearing may contact the Department using the Federal Relay Service at 1-800-877-8339. You should file a complaint with HUD as soon as possible. HUD may not help you if your complaint is filed more than one year after the last discriminatory act. You may also be able to file a complaint with a state or local fair housing agency. A list of the state and local fair housing agencies funded by HUD is available on HUD’s website here. ### HUD's mission is to create strong, sustainable, inclusive communities and quality affordable homes for all. More information about HUD and its programs is available at www.hud.gov and https://espanol.hud.gov. You can also follow HUD on Twitter and Facebook or sign up for news alerts on HUD's Email List. Learn More About HUD's Property Appraisal and Valuation Equity Work"
"Friday, March 29, 2024",https://www.hud.gov/press/press_releases_media_advisories/HUD_No_24_065,HUD Announces Expansion of Program to Promote Innovations in Housing,"Moving to Work Program expansion enables communities to develop creative housing solutions and resident services. WASHINGTON - Today, U.S. Department of Housing and Urban Development (HUD) Acting Secretary Adrianne Todman announced the final cohort of Moving to Work (MTW) Demonstration program expansion after extensive collaboration with Congress, advocates, and industry groups. 14 selected housing agencies will evaluate MTW's impact on administrative efficiency and resident services. MTW offers flexibility to create customized solutions to help residents and increase housing choice for families. “We are committed to finding innovative solutions that increase and preserve our housing supply and empowers families,” said Acting Secretary Adrianne Todman. “With this expansion complete, we look forward to learning from these communities and applying the most promising and successful ideas to inform future policy and programs.” The program gives housing agencies the freedom to design and test local strategies, to be innovative and creative when designing and implementing policies and programs; and to come up with solutions that meet the needs of their community, and most importantly the families they serve. HUD collaborated closely with the Federal Research Advisory Council to shape policies evaluated by the five cohorts. With this milestone, 139 MTW housing agencies now operate nationwide across 40 states and D.C. Notably, 17 states without prior MTW housing agencies now have access to flexibilities. “Well performing housing agencies can take their operations to the next level with the administrative flexibility and the ability to be more creative in fulfilling their mission,” said Richard J. Monocchio, Principal Deputy Assistant Secretary for Public and Indian Housing. “It’s an exciting time at HUD. With this final cohort, we now have 100 additional housing agencies leading locally-designed housing innovations that will contribute to the Department’s cutting-edge policy development that can be scaled nationally.” First authorized by Congress in 1996, MTW is a demonstration that provides housing agencies the opportunity to redefine how they operate by giving them flexibility to try “outside the box” ideas that address local community needs in innovative ways. MTW agencies are trailblazers in driving innovation in the delivery of providing housing and services to low-income residents. The program encourages an entrepreneurial spirit to create solutions in a new way. MTW agencies have directly influenced national policy for over 25 years, paving the way for the future delivery of federally assisted housing. The following housing agencies were selected for the MTW Flexibility II Cohort: ### HUD's mission is to create strong, sustainable, inclusive communities and quality affordable homes for all. More information about HUD and its programs is available at www.hud.gov and https://espanol.hud.gov. You can also follow HUD on Twitter and Facebook or sign up for news alerts on HUD's Email List. Learn More About HUD's Property Appraisal and Valuation Equity Work"
"Thursday, March 28, 2024",https://www.hud.gov/press/press_releases_media_advisories/HUD_No_24_064,Biden-Harris Administration Announces $173 Million to Make Homes More Energy Efficient and Climate Resilient for Low-Income Americans as Part of President Biden’s Investing in America Agenda,"Over half of Green and Resilient Retrofit Program funding has now been awarded to combat the climate crisis, advance environmental justice, and improve lives for residents in HUD-supported housing. WASHINGTON - The U.S. Department of Housing and Urban Development (HUD) today announced $173.8 million in new grant and loan awards under its Green and Resilient Retrofit Program (GRRP), bringing the total funding awarded under this program to a total of $544 million, or more than 50 percent of funding being awarded through this program. The announcement was made today by HUD Acting Secretary Adrianne Todman and Chicago Mayor Brandon Johnson at Archer Courts in Chicago, IL, which was awarded an $11.76 million grant under the program. The funds will be used by owner Jonathan Rose Companies for substantial energy efficiency renovations at this 146-unit property, which is home to low-income individuals and families. The grants and loans announced today as part of President Biden’s Investing in America agenda will support energy efficiency and climate resilience renovations at 25 properties participating in HUD’s Multifamily project-based rental assistance programs for low-income individuals, families, and seniors. All of the investments announced today will advance environmental justice in line with President Biden’s Justice40 Initiative which sets a goal that 40 percent of the overall benefits of certain federal investments flow to disadvantaged communities that are marginalized by underinvestment and overburdened by pollution. Retrofitting these homes will reduce their carbon emissions, make them more resilient to extreme weather events, and advance the President’s housing and clean energy agenda, ensuring affordable housing stays affordable for residents and building owners across the nation. Today’s awards include the first GRRP retrofit awards for properties located in the states of Colorado, Florida, Mississippi, North Carolina, North Dakota, Oregon, and Washington. “The Green and Resilient Retrofit Program is designed to improve the health, safety, quality and comfort of residents’ homes and to ensure HUD-assisted multifamily housing becomes more sustainable,” said Acting Secretary Adrianne Todman. “The Biden-Harris Administration is committed to addressing the negative impacts of climate change and HUD’s programs are an important part of this work.” “Far too many Americans struggle to stay warm in the winter and cool in the summer,” said John Podesta, Senior Advisor to the President for International Climate Policy. “Today’s awards from the Department of Housing and Urban Development will boost the quality of life for thousands of moderate- and low-income American families by making their homes safer and more comfortable.” “President Biden’s Investing in America agenda has accelerated our efforts to deliver environmental justice for communities that have been left behind for too long. As part of the President’s Justice40 Initiative, every single grant awarded under this program is delivering safe and climate resilient housing for residents most in need, including many that are at risk for damage from flooding and other climate fueled-extreme weather events,” said Brenda Mallory, Chair of the White House Council on Environmental Quality. The GRRP Comprehensive awards provide funding to properties with the highest need for climate resilience and utility efficiency upgrades. The 25 properties receiving Comprehensive awards today represent a mix of property sizes, affordable housing program participation, and energy efficiency and climate resilience needs. Eight are properties participating in the HUD Section 202 project-based rental assistance program for low-income seniors and 17 are properties participating in the HUD Section 8 project-based rental assistance program for low-income individuals and families. One property has more than 200 units, 17 properties have between 51-200 units, and seven properties have 50 or fewer units. Five properties have very high need for energy efficiency improvements and 14 properties have very high climate risks which include the risk of significant damage and disruption to residents from climate and extreme weather hazards, such as extreme heat, hurricanes, flooding, and other catastrophic storm events. View the full list of grantees here. “The power of the Green and Resilient Retrofit Program to transform properties and the lives of low-income families is underscored by the variety of applications we continue to receive for energy efficiency and climate resilience projects,” said Assistant Secretary for Housing Julia Gordon. “Today’s announcement reinforces this Administration’s dual commitment to addressing climate challenges and providing safer and healthier homes for low-income families and seniors.” President Biden’s Inflation Reduction Act-the largest climate investment in history-established the GRRP in 2022 to fund energy efficiency and resiliency improvements for HUD’s assisted rental portfolio. FACT SHEET: Green and Resilient Retrofit Program Progress to Date GRRP is the first HUD program to simultaneously invest in energy efficiency, renewable energy generation, climate resilience, and low-embodied-carbon materials in HUD-assisted multifamily housing. All of the investments under the GRRP will be made in affordable housing communities serving low-income families, directly benefiting HUD-assisted housing, in alignment with the Justice40 Initiative. At the 50 percent mark of planned award funding being distributed to 109 properties and more than 12,600 rental homes, to make them greener, healthier, and safer for low-income households, seniors, and persons with disabilities. The projects span the range from targeted upgrades to major net-zero renovation for properties in 38 states and the District of Columbia As of March 28, 2024, HUD has awarded $544.4 million in grants and surplus cash loans under the GRRP; $240.1 million in grants and $304.3 million in surplus cash loans. Of the awardees receiving grants and loans in six rounds of funding, 87 are properties receiving Multifamily Section 8 project-based rental assistance, 21 properties are receiving Section 202 project-based rental assistance for low-income seniors, and one is receiving Section 811 project-based rental assistance for low-income persons with disabilities. GRRP funding is being used for insulation, energy efficient windows and doors, heat-resistant roofs, energy efficient heating and cooling, resiliency measures and other improvements. GRRP is designed to work for properties of all sizes, and with a range of energy efficiency and climate resilience needs. Almost 20 properties receiving grant and loan awards have fewer than 50 units, some 70 properties have between 50 and 100 units, while 15 have more than 200 units. More than 700 properties have also signed up for HUD’s free energy and water benchmarking service, funded with more than $40 million from the President’s Inflation Reduction Act, so that HUD-assisted housing property owners can better understand the energy and water consumption at their properties in relation to other similar properties. This benchmarking information can in turn be used to assess energy efficiency and water conservation upgrades that can be funded under the GRRP. Green and Resilient Retrofit Program Background Detail The GRRP Notices of Funding Opportunity (NOFO) and additional guidance detail the multiple funding options for which property owners may apply: Elements provides funding to owners for proven and meaningful climate resilience and utility efficiency measures in projects that are already in the process of being recapitalized. Leading Edge provides funding to owners with plans for ambitious retrofit activities to achieve zero energy retrofits and an advanced green certification. Comprehensive provides funding to properties with the highest need for climate resilience and utility efficiency upgrades, regardless of prior development or environmental retrofit experience. Green and Resilient Retrofit Program Comprehensive Round Two Awards March 28, 2024 ### HUD's mission is to create strong, sustainable, inclusive communities and quality affordable homes for all. More information about HUD and its programs is available at www.hud.gov and https://espanol.hud.gov. You can also connect with HUD on social media and follow Secretary Fudge on Twitter and Facebook or sign up for news alerts on HUD's Email List. HUD COVID-19 Resources and Fact Sheets Learn More About HUD's Property Appraisal and Valuation Equity Work"
