Date,URL,Title,Text
"Wednesday, May 15, 2024",https://www.hud.gov/press/press_releases_media_advisories/HUD_No_24_113,Biden-Harris Administration Announces $1.1 Billion for Tribal Housing and Community Development,"WASHINGTON - Today, U.S. Department of Housing and Urban Development (HUD) Acting Secretary Adrianne Todman welcomed the Tribal Intergovernmental Advisory Committee at HUD Headquarters where she announced awarding a record $1.1 billion in funding for the Indian Housing Block Grant (IHBG) program and a $75 million funding opportunity for the Indian Community Development Block (ICDBG) program to support housing and community development projects. “By prioritizing funding and support for housing in Tribal communities, HUD is living up to its mission of ensuring that everyone in this country has access to affordable housing options,” said Acting Secretary Adrianne Todman. “As we commemorate the 50th anniversary of the Indian Community Development Block Grant program, we are investing in the continued health of Tribal communities across our country. Today’s announcement emphasizes the Biden-Harris Administration’s dedication to strengthening the Nation-to-Nation relationship with Tribes and making key investments in Indian Country.” The IHBG program is the primary means by which the Federal Government fulfills its trust responsibilities to provide adequate housing to Native Americans and is the single largest source of Indian housing assistance. The $1.1 billion in funding represents a 40-percent increase from last year and marks the largest ever funding investment in Indian housing. Funding can be used for affordable housing activities including new housing construction, rehabilitation, and housing services, and more. The $75 million that will be awarded through the ICDBG program will provide eligible grantees with assistance in developing viable American Indian and Alaska Native communities. Projects in Indian Country tend to focus on affordable housing rehabilitation, and construction of community buildings and infrastructure. At the onset of this Administration, we witnessed unprecedented housing challenges caused by the COVID-19 pandemic, rising rents, historically high interest rates, affordable housing shortages, and the cumulative effects of a deep history of housing discrimination. Millions of Americans were behind on their rents and mortgages and HUD stood in the gap. Issues facing the American people at the start of 2021 burdened families of all income levels, with a particular impact on low- and moderate-income families. This was particularly true for Tribal communities. Since that time, the Biden-Harris Administration has taken great strides to affect positive change in Tribal housing, including: HUD Provided Historic Investments in Tribal Communities In FY 2024, HUD has awarded more than $1 billion in funding for housing in Tribal communities through the following three major programs: the Indian Housing Block Grant (IHBG) program the IHBG Competitive program the Indian Community Development Block Grant program the Indian Housing Block Grant (IHBG) program the IHBG Competitive program the Indian Community Development Block Grant program In FY 2023 alone, Tribes and Tribally Designated Housing Entities acquired almost 1,000 new housing units through the IHBG and IHBG Competitive programs. HUD Made Homeownership More Accessible and Affordable for Native American Families HUD reduced fees charged to homebuyers with Section 184 Indian Home loan – a move that allowed more people to qualify for a mortgage and can save the average Native American family almost $6,800 over the term of their loan. Additionally, new regulations were published to improve and modernize the Section 184 program this spring. HUD Honors Trust Responsibilities and Promotes Self-Determination On December 6, 2023, President Biden issued an Executive Order to reform Federal processes for Tribal Nations and better support Tribes in embracing trust responsibilities and promoting the next era of Tribal self-determination. The Executive Order directs all Federal agencies to assess historical underfunding of Tribal programs by reviewing and evaluating programs and funding sources where Tribes are eligible and take action to increase access and reduce administrative burden for Tribes. HUD has already taken steps to implement the Executive Order by establishing funding set-asides for Tribes in various competitive programs and will continue to take action to further the purposes of the Executive Order across HUD programs. HUD Worked to Strengthen Nation-to-Nation Relationships On January 26, 2021, President Biden issued a Presidential Memorandum on Tribal Consultation and Strengthening Nation-to-Nation Relationships. The Memorandum affirms the Administration’s commitment to Tribal sovereignty and to fulfilling Federal trust and treaty responsibilities to Tribal Nations and calls for Federal agencies to take action. HUD quickly responded by developing a Tribal Consultation Plan of Actions and expanding its Tribal consultation efforts throughout the Department. In response to President Biden’s Memorandum on Tribal Consultation and Strengthening Nation-to-Nation Relationships, HUD established its first Tribal Intergovernmental Advisory Committee (TIAC). The TIAC brings together senior HUD leadership and Tribal Leaders to ensure the needs of Tribes are being met in how HUD programs are designed and implemented. HUD provided relief to Tribal communities during the COVID-19 Pandemic The Biden-Harris Administration responded with the American Rescue Plan, which provided $750 million in HUD resources to Indian Country. HUD works to serve Native Veterans every day The Biden-Harris Administration has provided continued support for Native veterans through the Tribal HUD-Veterans Affairs Supportive Housing (Tribal HUD-VASH) program, which links housing with other vital services for veterans. More than 440 Native veterans are currently being served through the Tribal HUD-VASH program. ### HUD's mission is to create strong, sustainable, inclusive communities and quality affordable homes for all. More information about HUD and its programs is available at www.hud.gov and https://espanol.hud.gov. You can also follow HUD on Twitter and Facebook or sign up for news alerts on HUD's Email List. Learn More About HUD's Property Appraisal and Valuation Equity Work"
"Tuesday, May 14, 2024",https://www.hud.gov/press/press_releases_media_advisories/HUD_No_24_112,HUD Announces $30 Billion Investment to Keep American Families Housed,"WASHINGTON - Today, the U.S. Department of Housing and Urban Development (HUD) announced $30 billion in renewal funding for the Housing Choice Voucher Program (HCV). This funding will help Public Housing Authorities (PHAs) continue to provide assistance to families and individuals who are in need of affordable housing options. “These housing choice vouchers will create stability and certainty for individuals and families throughout the country,” said HUD Acting Secretary Adrianne Todman. “As HUD’s single largest investment in affordable housing, these funds make accessing affordable housing less burdensome for renters, public housing authorities, and landlords. Since last year, the HCV program saw a $2 billion increase in funding to help maintain housing vouchers for families across the country. Since 2022, this budget allocation has grown nearly 20% (over $4 billion), allowing the value of a Housing Choice Voucher to keep pace with rising rental costs, and helping to make sure that voucher holders can continue to access neighborhoods of opportunity. This announcement is a continuation of the Biden-Harris Administration’s efforts to increase the housing supply across the country for those who are most in need. “The HCV program is the most successful rental program ever conceived,” said Principal Deputy Assistant Secretary for Public and Indian Housing, Richard J. Monocchio. “Not only do housing vouchers free up income for basic needs, but when families are able to live in stable, affordable housing in low-poverty communities, we see higher cognitive test scores and educational outcomes for children and increased chances of attending college and earning more as adults.” Housing Vouchers assist over 2.3 million families in need of housing, including families with children, older adults, veterans, and people with disabilities, making it the most effective intervention to reduce homelessness and housing instability. Housing Vouchers offer families flexibility and a wider range of affordable housing options in communities with better schools, or access to jobs or other opportunities, but landlords must be willing to accept vouchers for them to be effective. HUD continues to work with communities to help them promote the housing choice voucher program by offering tools for landlord engagement and working with PHAs to meet their local housing needs with the HCV utilization resources. Click here to see a list of communities who have received funding. ### HUD's mission is to create strong, sustainable, inclusive communities and quality affordable homes for all. More information about HUD and its programs is available at www.hud.gov and https://espanol.hud.gov. You can also follow HUD on Twitter and Facebook or sign up for news alerts on HUD's Email List. Learn More About HUD's Property Appraisal and Valuation Equity Work"
"Monday, May 13, 2024",https://www.hud.gov/press/press_releases_media_advisories/HUD_No_24_111,"HUD and Rocket Mortgage, LLC Reach Agreement on Montana Fair Lending Complaint for Home Purchase within Tribal Lands","WASHINGTON - The U.S. Department of Housing and Urban Development (HUD) announced today that it has entered into a Conciliation Agreement with Rocket Mortgage, LLC resolving allegations that Rocket Mortgage denied a mortgage loan application based on race because the home being purchased was located within the Tribal boundaries of a federally recognized reservation. Read the Agreement. The agreement stems from a complaint filed by a couple applying for a mortgage to purchase a single-family home within the boundaries of the Flathead Indian Reservation in St. Ignatius, Montana. Rocket Mortgage denied the loan application. As a result, complainants allege they were forced to pay a higher interest rate and accept a loan from another lender on less-favorable terms. The agreement resolves the complaint with Rocket Mortgage. “No one seeking to purchase a home should be subjected to unlawful discrimination when applying for a home mortgage,” said Demetria L. McCain, HUD’s Principal Deputy Secretary for Fair Housing and Equal Opportunity. “This agreement demonstrates HUD’s commitment to ensuring fair lending for homeowners and home purchasers living on Tribal lands.” The agreement secures $65,000 compensation to complainants, requires Rocket Mortgage to provide fair lending training to its employees, and requires Rocket Mortgage to abide by fair lending requirements for applicants seeking residential mortgage credit located within the boundaries of a Native American reservation. Additionally, Rocket Mortgage will invest at least $30,000 to provide financial support for programs that improve housing conditions, consumer financial literacy and education, outreach and homeownership education or counseling for Native Americans. Rocket Mortgage also agreed to conduct outreach through its website and social media platforms describing the company’s broad range of financing options available to eligible applicants whose loans are secured by property located within the boundaries of Native American reservations. People who believe they have experienced discrimination may file a complaint by contacting HUD's Office of Fair Housing and Equal Opportunity at (800) 669-9777 (voice) or (800) 877-8339 (Relay). Housing discrimination complaints may also be filed at hud.gov/fairhousing. ### HUD's mission is to create strong, sustainable, inclusive communities and quality affordable homes for all. More information about HUD and its programs is available at www.hud.gov and https://espanol.hud.gov. You can also follow HUD on Twitter and Facebook or sign up for news alerts on HUD's Email List. Learn More About HUD's Property Appraisal and Valuation Equity Work"
"Monday, May 13, 2024",https://www.hud.gov/press/press_releases_media_advisories/HUD_No_24_110,HUD is Expanding Solutions to Tackle Homelessness with Housing Vouchers,"WASHINGTON - Today, the U.S. Department of Housing and Urban Development (HUD) announced a new opportunity for communities to expedite housing assistance for people experiencing homelessness in the Housing Choice Voucher program. Housing agencies can now request to accept self-certification of income to determine program eligibility for people experiencing homelessness. This can help shorten the amount of time it takes to move into healthy, stable homes. “Broadening the Biden-Harris Administration’s efforts to keep American’s housed, HUD is doing all we can to support communities’ actions to end homelessness and transition into affordable homes.” Said HUD Acting Secretary Adrianne Todman. “Today’s announcement of flexibilities helps to make federal rental assistance more accessible and more quickly available to the individuals and families that need it the most.” People experiencing homelessness often may not have the necessary documents readily available that are typically required to establish their eligibility for voucher assistance such as social security cards or pay stubs. Because missing documents can significantly delay assistance and timely access to housing, these Housing Choice Voucher waivers will allow housing agencies to accept self-certification of income, disability status, and other specific information to expedite assistance to people experiencing homelessness. Agencies must then verify tenants’ eligibility within 90 days after they begin receiving assistance. Housing Choice Vouchers help low-income families, the elderly, and persons with disabilities accessibility to decent and safe rental housing in the private market, and are an important part of federal, state, and local strategies to reduce homelessness. The waivers that HUD has approved are available to communities experiencing significant or rising rates of homelessness. ### HUD's mission is to create strong, sustainable, inclusive communities and quality affordable homes for all. More information about HUD and its programs is available at www.hud.gov and https://espanol.hud.gov. You can also follow HUD on Twitter and Facebook or sign up for news alerts on HUD's Email List. Learn More About HUD's Property Appraisal and Valuation Equity Work"
"Friday, May 10, 2024",https://www.hud.gov/press/press_releases_media_advisories/HUD_No_24_109,HUD Announces Co-Presenters for the 2024 Innovative Housing Showcase,"WASHINGTON - Today, the U.S. Department of Housing and Urban Development (HUD) announced the International Code Council (ICC), the Manufactured Housing Institute (MHI), the National Multifamily Housing Council (NMHC), and the Structural Building Components Association (SBCA) as the co-presenters for the 2024 Innovative Housing Showcase. This collaborative effort promises to highlight cutting-edge building technologies and housing solutions aimed at lowering costs and increasing climate resilience for American families. “In what’s now an annual tradition, we engage thousands of Americans on the National Mall in new, innovative methods for building housing. But we cannot do this alone – we rely on our amazing partners and co-presenters to bring this effort to fruition,” said HUD Acting Secretary Adrianne Todman. “Together, we are looking forward to hosting thousands more visitors this June, highlighting how we can build resilient, affordable homes into the future.” “HUD is excited to partner with these four national housing and building organizations to present the 2024 Innovative Housing Showcase,” said Solomon Greene, Principal Deputy Assistant Secretary for Policy Development and Research. “These co-presenters represent key partners in the housing ecosystem and, like HUD, they recognize the power of innovation and collaboration. The Showcase will offer a unique opportunity to highlight the latest technologies and designs, as well as the cross-sector partnerships that are needed to meet the nation’s growing housing affordability and climate resilience needs.” “Innovation is the cornerstone of resilient and affordable housing,” said Dominic Sims, CBO, Chief Executive Officer for the International Code Council. “The Council Code welcomes the opportunity to work alongside HUD and other construction industry stakeholders to advance the codes and standards needed to ensure safe, resilient and accessible housing for all. From sustainable and resilient materials to off-site construction and hazard mitigation, our collective commitment to innovation remains a top priority.” “MHI is pleased to be a co-presenter for the 2024 Innovative Housing Showcase,” said Dr. Lesli Gooch, Chief Executive Officer for the Manufactured Housing Institute. ""This year is especially meaningful as it marks the 50th Anniversary of the law that authorized the HUD Code for Manufactured Housing, establishing a collaboration with industry that continues through this day. As the HUD Code continues to be updated to foster innovation, we are able to meet a wider range of housing supply needs, scaling the efficiency of off-site construction to expand attainable homeownership.” ""We are excited to be back on the National Mall for the Innovative Housing Showcase, this year as both an exhibitor and a co-presenter of the event,” said Jess Lohse, Executive Director for the Structural Building Components Association. “This is a great opportunity to share the benefits of structural building components, like trusses and wall panels, and feature how efficient and beneficial these offsite structural framing solutions are for the industry."" “Rental housing providers are working hard to alleviate the national housing shortage and make housing more affordable. Over 4.3 million apartments in all 50 states and D.C. have adopted The Foundations of Rental Housing - a set of six business principles that residents can expect from their rental housing provider,” said Sharon Wilson Géno, President for the National Multifamily Housing Council. “The Foundations of Rental Housing, powered by the National Multifamily Housing Council (NMHC) is proud to partner with HUD on the Innovative Housing Showcase with the goal of highlighting real, actionable solutions to our housing crisis.” For more information and to stay updated, please visit HUD.gov/Innovative_Housing. Interested media should reach out to HUDPressOffice@HUD.gov. ### HUD's mission is to create strong, sustainable, inclusive communities and quality affordable homes for all. More information about HUD and its programs is available at www.hud.gov and https://espanol.hud.gov. You can also follow HUD on Twitter and Facebook or sign up for news alerts on HUD's Email List. Learn More About HUD's Property Appraisal and Valuation Equity Work"
"Thursday, May 9, 2024",https://www.hud.gov/press/press_releases_media_advisories/HUD_No_24_108,HUD Officials Visit Seattle as Part of National “Road to Innovation” Tour,"SEATTLE - This week, the U.S. Department of Housing and Urban Development (HUD) Principal Deputy Assistant Secretary for Policy Development and Research Solomon Greene and Northwest Regional Administrator Andrew Lofton toured innovative affordable housing developments as part of HUD's national ""Road to Innovation” Tour leading up to the 2024 Innovative Housing Showcase in Washington, DC next month. “As the Road to Innovation Tour continues, we’re learning that not only are Housing Authorities at the forefront of incorporating new building technologies to deepen affordability, promote energy efficiency, and provide homes that meet resident needs, but they are also innovating in financing, and resident engagement strategies,"" said Solomon Greene, Principal Deputy Assistant Secretary for Policy Development and Research. ""It isn’t just technology that is driving progress, but the people coming together to innovate on solutions. The redevelopment of Yesler Terrace is a great example of this, having its roots in robust resident engagement and community-led design, and today, leading the nation in implementing energy efficiency technologies that result in cost-savings for residents.” The “Road to Innovation” tours will culminate in Washington, DC with HUD’s 2024 Innovative Housing Showcase slated for June 7th through 9th on the National Mall. The showcase is a public event during which leading homebuilders, technologists, and designers will show their cutting-edge approaches to increase housing supply, lower construction costs, increase energy efficiency, and reduce housing expenses. ""The innovation - and community engagement and involvement that comes along with that innovation - is something that stands out in Seattle,” said HUD Northwest Regional Administrator Andrew Lofton. “I’m proud to showcase our good work as a national example that can be replicated across the country."" The first stop on the tour was to Seattle Housing Authority's Yesler community to visit Sawara, a new residential building nearing completion that has 69 HUD-funded vouchers covering over half of its 114 apartments. Sawara is an all-electric building that is part of Seattle City Light’s Exemplary Buildings Program that models energy-efficient, healthy, and durable housing. SHA's sustainable building features at Yesler include photovoltaic rooftop panels, LED lighting, energy saving appliances, low-flow faucet aerators and showerheads, double and triple-pane windows that reduce noise and conserve heat, individual energy-recovery heating and ventilation in each unit, solar hot water preheat and ultra-efficient CO2 heat pump systems, among many other amenities that make the community environmentally friendly and sustainable. “Environmental stewardship is one of the Seattle Housing Authority’s core values,” said Seattle Housing Authority Executive Director Rod Brandon. “We were one of the first housing authorities in the country to sign on to the U.S. Department of Energy Better Climate Challenge with a commitment to reduce greenhouse gas emissions and energy consumption by 50 and 15 percent respectively by 2032, and we incorporate sustainability in everything we do from building and redeveloping housing to helping our tenants conserve. Examples in housing include rooftop solar panels that generate renewable energy, capture systems that enable diversion and reuse of rainwater, energy recovery ventilation in units, energy saving appliances and building systems, and other innovations that are leading to measurable progress on reducing our impact on the environment.” The second tour location was to Sustainable Living Innovations' (SLI) 303 Battery apartment building. This 15-story, 112-unit building located in the Belltown neighborhood of downtown Seattle has been pre-certified by the International Living Institute as the first Net Zero Energy high rise multifamily tower in the world; it’s a 100% electric building and uses no fossil fuels. The building was constructed using approximately 960 panels assembled in SLI’s Tacoma facility, which were inserted into a steel exoskeleton that supports the high rise structure. Advanced technologies in the building including solar PV, lithium-ion battery storage, greywater treatment, waste heat recovery, and low voltage electrical systems. The last tour was at Burbridge Place, a 5-story building with 124 studio apartments for the non-profit Downtown Emergency Service Center or DESC, a leading homeless service provider in Seattle. The building is Permanent Supportive Housing (PSH) with $1.8 million in initial HUD Continuum of Care funding with an additional $1.9 million for the coming year. Burbridge Place showcases structural steel panel technology and innovative environmentally sustainable features. It is the first PSH building in the world built using a new patented panelized construction process, with rooftop solar, waste heat recovery, ultra-efficient AC and integrated technology similar to ""smart home"" design. “We continue to pioneer Housing First and what that means, especially from a building technologies standpoint,"" said DESC Facilities, Asset Management, and Property Development Director Sondra Nielsen. ### HUD's mission is to create strong, sustainable, inclusive communities and quality affordable homes for all. More information about HUD and its programs is available at www.hud.gov and https://espanol.hud.gov. You can also follow HUD on Twitter and Facebook or sign up for news alerts on HUD's Email List. Learn More About HUD's Property Appraisal and Valuation Equity Work"
