Date,URL,Title,Text
07/23/2018:,https://archives.hud.gov//news/2018/pr18-074.cfm,HUD and DOJ Launch Public Awareness Campaign Against Sexual Harassment in Housing,"WASHINGTON - The U.S. Department of Housing and Urban Development (HUD) and the U.S. Department of Justice (DOJ) today released a public service announcement (PSA) to raise awareness of housing-related sexual harassment and to reach persons who are victimized by it. To enhance the effectiveness of the campaign, HUD enlisted the assistance of victims to share their experiences and help convey the message that sexual harassment in housing is against the law. Watch the public service announcement (PSA) (https://youtu.be/-R3Q8ewWJas).
The 60-second PSA features three victims of sexual harassment who challenged their mistreatment in lawsuits brought by HUD under the Fair Housing Act. These women share their stories of abuse and the impact the experience they had on their lives.
Stephanie is one victim featured in the video, describing her experience with a landlord who threatened to evict her if she didn't have sex with him. ""It was something that I didn't want to do but I had to do it. I didn't know I had a choice at that time, but now that I do, I want other people to know that they do. I want other women to know that they don't have to take this. This is just uncalled for. It's unspeakable.""
""A person's home is where they should feel the safest, not to live in fear of being subjected to sexual harassment,"" said Anna María Farías, HUD's Assistant Secretary for Fair Housing and Equal Opportunity. ""This campaign will let the public know that they have help should they find themselves a victim of this type of behavior. The Justice Department and HUD are committed to working together to address the problem and protect their housing rights.""
""Unfortunately, there are still too many landlords and managers who attempt to prey on vulnerable individuals. The launch of the nationwide PSAs is an important step in proliferating the stories of brave women and men across the country in order to raise awareness and help other victims,"" said John Gore, Acting Assistant Attorney General of the Civil Rights Division. ""Our goal at the Justice Department is to make more people aware that no one should have to choose between a home and the right to be free from sexual harassment.""
The PSA released today is a joint effort between HUD and DOJ to raise awareness and make it easier for victims all over the country to find resources and report harassment. HUD will distribute the video to all Public Housing Agencies across the United States. The video is intended to air in all national media markets and will be distributed by social media to followers of HUD and the Justice Department, and amplified by other government agencies, partners, and organizations.
Last April, HUD and DOJ launched a campaign to combat sexual harassment in housing including three major components: a new HUD-DOJ Task Force to combat sexual harassment in housing; an outreach toolkit to leverage DOJ's nationwide network of U.S. Attorney's Offices, and; a public awareness campaign. The Department and HUD are working together to distribute the PSA as part of the Task Force's coordinated public outreach efforts.
Individuals who believe that they may have been victims of sexual harassment in housing should call the Department at (844) 380-6178, send an email to fairhousing@usdoj.gov, or contact HUD at (800) 669-9777. If you have information or questions about any other housing discrimination, you can contact the Department at (800) 896-7743."
07/23/2018:,https://archives.hud.gov//news/2018/pr18-075.cfm,HUD and Census Bureau Report New Residential Sales in June 2018,"WASHINGTON - The U.S. Department of Housing and Urban Development (HUD) and the U.S. Census Bureau jointly announced the following new residential sales statistics for June 2018:

New Home Sales
Sales of new single-family houses in June 2018 were at a seasonally adjusted annual rate of 631,000. This is 5.3 percent (±17.1 percent)* below the revised May rate of 666,000 but is 2.4 percent (±24.0 percent)* above the June 2017 estimate of 616,000.
Sales Price
The median sales price of new houses sold in June 2018 was $302,100. The average sales price was $363,300.
For Sale Inventory and Months' Supply
The seasonally adjusted estimate of new houses for sale at the end of June was 301,000. This represents a supply of 5.7 months at the current sales rate.
The July report is scheduled for release on August 23, 2018.
Read more about new residential sales activity (https://www.census.gov/construction/nrs/index.html).
EXPLANATORY NOTES
In interpreting changes in the statistics in this release, note that month-to-month changes in seasonally adjusted statistics often show movements which may be irregular. It may take three months to establish an underlying trend for building permit authorizations, six months for total starts, and six months for total completions. The statistics in this release are estimated from sample surveys and are subject to sampling variability as well as nonsampling error including bias and variance from response, nonreporting, and undercoverage. Estimated relative standard errors of the most recent data are shown in the tables. Whenever a statement such as ""2.5 percent (±3.2 percent) above"" appears in the text, this indicates the range (-0.7 to +5.7 percent) in which the actual percentage change is likely to have occurred. All ranges given for percentage changes are 90 percent confidence intervals and account only for sampling variability. If a range does not contain zero, the change is statistically significant. If it does contain zero, the change is not statistically significant; that is, it is uncertain whether there was an increase or decrease. The same policies apply to the confidence intervals for percentage changes shown in the tables. On average, the preliminary seasonally adjusted estimates of total building permits, housing starts and housing completions are revised 3 percent or less. Explanations of confidence intervals and sampling variability can be found at the Census Bureau's website (https://www.census.gov/construction/nrs/how_the_data_are_collected/index.html).
* The 90 percent confidence interval includes zero. In such cases, there is insufficient statistical evidence to conclude that the actual change is different from zero."
07/27/2018:,https://archives.hud.gov//news/2018/pr18-076.cfm,"HUD Reaches Agreements with Housing Providers in California, Idaho and Hawaii Settling Claims of Discrimination Against Individuals with Disabilities","WASHINGTON - The U.S. Department of Housing and Urban Development (HUD) announced today that it has approved settlement agreements with housing providers in California and Idaho resolving allegations that they denied the reasonable accommodation requests of residents with disabilities who needed assistance animals or a first-floor apartment.
In addition, HUD approved a Voluntary Compliance Agreement (VCA) resolving findings which indicated that Hawaii Public Housing Authority failed to provide enough accessible units for residents with disabilities. Read the agreement.
The Fair Housing Act makes it unlawful to discriminate in the sale, rental, and financing of dwellings, and in other housing-related transactions, based on disability. This includes refusing to make reasonable accommodations in rules, policies, practices, or services or facilities related to housing. Section 504 of the Rehabilitation Act of 1973 prohibits discrimination on the basis of disability in programs and activities receiving federal financial assistance.
""Denying persons with disabilities the accommodations they need or failing to build accessible housing violates the law,"" said Anna María Farías HUD's Assistant Secretary for Fair Housing and Equal Opportunity. ""Hopefully, the settlements we're announcing today will help housing providers recognize their obligation to comply with the nation's fair housing laws and make a commitment to meeting that obligation.""
The agreements announced today are:
Rancho Cordova, California
HUD approved a Conciliation Agreement with the owners of Fountain Crest Apartments settling allegations that the owners demanded that a tenant with disabilities remove her assistance animal from the property. Among other things, the Conciliation Agreement provides that the tenant will receive $10,000 and the property owners will revise their reasonable accommodation policies and receive training to ensure compliance with the Fair Housing Act.
San Diego, California
HUD approved a Conciliation Agreement with the owners of Summit at Alpine Apartment Homes Limited Partnership and Property West Residential Management Company resolving allegations that they denied a tenant's reasonable accommodation request to move to a ground-floor unit due to a mobility disability. Under the agreement, Property West Residential Management Company will pay the woman $6,500. In addition, leasing and management staff at Summit at Alpine Apartment Homes Limited Partnership and Property West Residential Management Company will undergo fair housing training.
Pocatello, Idaho
HUD approved a Conciliation Agreement with the owners of rental properties in Pocatello, settling allegations that they denied the request of a tenant with disabilities to keep an emotional support animal. The tenant alleged that the owners initially denied her request, but later agreed to grant her request, imposing numerous terms and conditions that violated the Fair Housing Act. Under the agreement, the owners will pay the woman $6,000 and revise their rental procedures to be consistent with the Fair Housing Act.
Honolulu, Hawaii
HUD approved a Voluntary Compliance Agreement (VCA) between the Hawaii Disability Rights Center and the Hawaii Public Housing Authority (HPHA). Under the VCA, HPHA will work cooperatively to resolve issues pertaining to a compliance review which found that HPHA failed to comply with the requirements of Section 504 of the Rehabilitation Act of 1973. Among other findings, the compliance review revealed that HPHA did not have an adequate percentage of accessible units available for residents with disabilities. Also under the VCA, HPHA will contract with an expert accessibility consultant to ensure that it meets its accessibility mandates, including conducting assessments of residents' accommodation needs.
Persons who believe they have experienced discrimination may file a complaint by contacting HUD's Office of Fair Housing and Equal Opportunity at (800) 669-9777 (voice) or (800) 927-9275 (TTY). Housing discrimination complaints may also be filed by going to www.hud.gov/fairhousing."
07/27/2018:,https://archives.hud.gov//news/2018/pr18-077.cfm,2018 HUD Secretary Design Award Winners Announced,"WASHINGTON - The U.S. Department of Housing and Urban Development (HUD) and the American Institute of Architects (AIA) today announced the winners of the 2018 HUD Secretary's Housing and Community Design Award (https://www.huduser.gov/portal/about/housingCommDesign-intro.html). HUD and the AIA selected affordable housing developments in California and Oregon for their overall excellence in either affordable housing design or housing accessibility.
""I want to recognize these outstanding developments for their architectural ingenuity and the impact that they're making on their communities,"" said HUD Secretary Ben Carson. ""These developments not only provide critically needed affordable housing to low-income families and individuals with disabilities, they prove affordable housing can be attractive and responsive to the needs of their communities.""
The new HUD Secretary's Housing and Community Design Award recipients are:
Excellence in Affordable Housing Design - This award recognizes architecture that demonstrates overall excellence in terms of design in response to both the needs and constraints of affordable housing.
Five88 Apartments in San Francisco is a new 100 percent affordable housing development, skillfully constructed on a coastal landfill. The development includes 200 apartments for low-income families in the developing Mission Bay area. Built on challenging landscape the architectural design of the development is both innovative and visually striking.
The building transitions from four stories on one side to three on the other. From uniquely tilted stairs to a bamboo exterior, this affordable housing unit combines functionality with an aesthetic appeal. Five88 includes 10,000-square feet of retail space aiding in the development of the community. This development is transit-oriented and focused on enabling low-income families to move closer to the city and the places most important to them.
Housing Accessibility - Alan J. Rothman Award - The purpose of this award is to recognize exemplary projects that demonstrate excellence in improving housing accessibility for people with disabilities.
The Station 162 Apartments near Portland, Oregon is the fifth housing project developed by QUAD, Inc (Quadriplegics United Against Dependency). The person behind this endeavor, Bud Myers, is himself quadriplegic and realized the critical shortage of independent housing developments to aid injured individuals transitioning to a life with disabilities. Ten years before the passage of the Americans with Disabilities Act, with help from community resources he opened the first independent living center in the nation not affiliated with a hospital or rehabilitation center.
The Station 162 Apartments feature everything the Americans with Disabilities Act established including entirely barrier-free units and independent supportive services provided upon request.
Larger than Quad's previous developments, this complex was designed with the needs of their future residents in mind and has gained national attention for its efforts."
07/30/2018:,https://archives.hud.gov//news/2018/pr18-078.cfm,HUD Approves $1.5 Billion Disaster Recovery Plan in Puerto Rico,"WASHINGTON - U.S. Department of Housing and Urban Development (HUD) Secretary Ben Carson today announced HUD has approved a $1.5 billion disaster recovery plan (http://www.cdbg-dr.pr.gov/plan-de-accion-borrador/) to help citizens in Puerto Rico to recover from Hurricanes Irma and Maria. Puerto Rico recently submitted the plan for HUD's review which primarily focuses on the restoration of damaged and destroyed homes, businesses and infrastructure. Read Puerto Rico's recovery plan (http://www.cdbg-dr.pr.gov/en/action-plan-draft/).
Puerto Rico's long-term recovery is supported through HUD's Community Development Block Grant—Disaster Recovery (CDBG-DR) Program which requires grantees to develop thoughtful recovery plans informed by local residents. Learn more about CDBG-DR and the State's role in long-term disaster recovery (https://youtu.be/Lrmwz8IXXdQ) (en español (https://www.youtube.com/watch?v=Uuy63y45L7s)).
""Today, we turn an important corner in our long-term effort to rebuild hard-hit communities in Puerto Rico,"" said Secretary Carson. ""This is just the beginning - billions in federal disaster recovery funding will soon be put to work and help our fellow citizens in Puerto Rico rebuild their homes and their lives.""
Background
On September 8, 2017, President Trump signed the Additional Supplemental Appropriations for Disaster Relief Requirements Act, 2017 (https://www.congress.gov/bill/115th-congress/house-bill/601/text). The Act appropriated $7.4 billion in CDBG-DR funding for major disasters declared in 2017. To distribute these funds, the Act requires HUD to direct the funds to the areas most impacted by last year's major disasters. On February 1, 2018, HUD allocated $1.5 billion of that appropriation to Puerto Rico to address the serious unmet needs on the island. The action plan approved today will put these funds to work.
On April 10, 2018, HUD allocated another $18.5 billion to further support recovery in Puerto Rico and to rebuild communities impacted by Hurricanes Maria and Irma and to protect them from major disasters in the future. HUD will shortly publish program rules to guide Puerto Rico and others on the use of those funds.
CDBG-DR grants support a variety of disaster recovery activities including housing redevelopment and rebuilding, business assistance, economic revitalization, and infrastructure repair. Grantees are required to spend the majority of these recovery funds in ""most impacted"" areas as identified by HUD. HUD will issue administrative guidelines shortly for use of the funds to address grantees' long-term recovery needs, particularly in the area of housing recovery.
To address unmet needs, Puerto Rico identified several housing, infrastructure and economic development recovery needs arising from Hurricanes Irma and Maria. Puerto Rico's disaster recovery action plan includes the following activities:
Housing ($1 billion) - Puerto Rico is investing more than $1 billion to restore the island's severely damaged housing stock. As part of the plan, Puerto Rico intends to provide up to $120,000 to rebuild destroyed homes for each qualified homeowner and up to $48,000 to repair each eligible damaged property. Additional housing investments include funding for rental assistance ($10,000,000), specifically for properties serving the elderly and other vulnerable households. Puerto Rico has also proposed a $36 million Home Emergency Resilience Program that provides up to $6,000 per household for individual solar appliances to help families.
• Housing ($1 billion) - Puerto Rico is investing more than $1 billion to restore the island's severely damaged housing stock. As part of the plan, Puerto Rico intends to provide up to $120,000 to rebuild destroyed homes for each qualified homeowner and up to $48,000 to repair each eligible damaged property. Additional housing investments include funding for rental assistance ($10,000,000), specifically for properties serving the elderly and other vulnerable households. Puerto Rico has also proposed a $36 million Home Emergency Resilience Program that provides up to $6,000 per household for individual solar appliances to help families.
Economic Revitalization ($145 million) - Puerto Rico's recovery plan provides $145 million for several activities to help revitalize the post-disaster economy, grants of up to $50,000 for eligible businesses. The plan also targets grants of up to small business incubators and accelerators ($10,000,000) awards of up to $2,500,000 for each eligible incubator operation, a workforce training program ($10,000,000) awards of up to $2,000,000 to train eligible Section 3 residents , and a construction and commercial revolving loan program ($35,000,000) that will provide up to $1,000,000 per loan to eligible businesses.
• Economic Revitalization ($145 million) - Puerto Rico's recovery plan provides $145 million for several activities to help revitalize the post-disaster economy, grants of up to $50,000 for eligible businesses. The plan also targets grants of up to small business incubators and accelerators ($10,000,000) awards of up to $2,500,000 for each eligible incubator operation, a workforce training program ($10,000,000) awards of up to $2,000,000 to train eligible Section 3 residents , and a construction and commercial revolving loan program ($35,000,000) that will provide up to $1,000,000 per loan to eligible businesses.
Infrastructure ($100 million) - To support the repair of damaged infrastructure on the island, Puerto Rico intends to target $100 million to match federal investments through the Federal Emergency Management Agency's (FEMA) Public Assistance and Hazard Mitigation Grant Program projects.
• Infrastructure ($100 million) - To support the repair of damaged infrastructure on the island, Puerto Rico intends to target $100 million to match federal investments through the Federal Emergency Management Agency's (FEMA) Public Assistance and Hazard Mitigation Grant Program projects."
08/13/2018:,https://archives.hud.gov//news/2018/pr18-079.cfm,HUD Seeks to Streamline and Enhance 'Affirmatively Furthering Fair Housing' Rule,"WASHINGTON - The U.S. Housing and Urban Development (HUD) today published a notice inviting public comment on amendments to its Affirmatively Furthering Fair Housing (AFFH) regulations. HUD's goal in pursuing new rulemaking is to offer more helpful guidance to states and local communities to effectively promote fair housing choice through the use of their federal funds. Read HUD's Advance Notice of Proposed Rulemaking (https://www.gpo.gov/fdsys/pkg/FR-2018-08-16/pdf/2018-17671.pdf).
As HUD begins the process of amending the existing AFFH regulations, it is soliciting public comment on changes that will: (1) minimize regulatory burden while more effectively aiding program participants to meet their statutory obligations, (2) create a process focused primarily on accomplishing positive results, rather than on analysis, (3) provide for greater local control and innovation, (4) seek to encourage actions that increase housing choice, including through greater housing supply, and (5) more efficiently utilize HUD resources.
""HUD believes very deeply in the purposes of the Fair Housing Act and that states, local governments, and public housing authorities further fair housing choice,"" said HUD Secretary Ben Carson. ""HUD's 2015 rule often dictated unworkable requirements and actually impeded the development and rehabilitation of affordable housing.""
""It's ironic that the current AFFH rule, which was designed to expand affordable housing choices, is actually suffocating investment in some of our most distressed neighborhoods that need our investment the most,"" Carson continued. ""We do not have to abandon communities in need. Instead we believe we can craft a new, fairer rule that creates choices for quality housing across all communities.""
""Today we begin the formal process of examining how we can get this regulation right by first listening and learning from those who must put these rules to work and live with its impact,"" Carson concluded.
Background
On July 16, 2015, HUD published its AFFH final rule. The stated purpose of that regulation was to provide HUD program participants with a revised planning approach to assist them in meeting their legal obligation to affirmatively further fair housing. Since then, HUD found that in contrast to its stated goals, the AFFH rule proved ineffective, highly prescriptive, and effectively discouraged the production of affordable housing.
Last January, HUD suspended the obligation of local governments to file plans under the regulation and, in May, withdrew a computer assessment tool required to be used by local governments in preparing those plans. HUD found that rather than assisting local governments in formulating acceptable fair housing assessments, the 'Local Government Assessment Tool' was confusing, difficult to use, contained errors, and frequently produced unacceptable assessments, and otherwise required an unsustainable level of technical assistance. HUD continues to review comments submitted in response to the withdrawal of the Local Government Assessment Tool. The Department will consider those comments during its consideration of potential changes to the AFFH regulations."
