Date,URL,Title,Text
09/05/2019:,https://archives.hud.gov//news/2019/pr19-135.cfm,The Department of Housing and Urban Development Submits Housing Reform Plan to the President,"WASHINGTON - Today, the Department of Housing and Urban Development (HUD) presented President Donald Trump with a plan for reforming the Nation's housing finance system. Read HUD's housing finance reform plan.
On March 27, 2019, President Trump issued a Memorandum on Federal Housing Finance Reform, directing HUD and the Department of Treasury to craft the housing finance reform plans released today. HUD plays a critical role in the Nation's housing finance system, primarily through the Federal Housing Administration (FHA). FHA currently insures 8.1 million single-family forward mortgages, nearly 500,000 reverse mortgages, and 15,500 multifamily and healthcare properties. In addition, the Government National Mortgage Association (Ginnie Mae) guarantees more than $2 trillion in mortgage-backed securities.
""As a direct result of the Trump Administration's pro-growth policies, unemployment is at 50-year low and American families are earning higher incomes and enjoying more opportunities than seemed possible just a few years ago,"" said Secretary Ben Carson. ""There is still one piece of unfinished business from the financial crisis: housing finance reform. These changes to our housing finance system will help more American families achieve their dream of owning a home.""
The reform plan presented today ensures FHA and Ginnie Mae can continue to serve their important missions effectively, responsibly, and sustainably for many years to come. HUD's reform plan accomplishes four objectives:
• Refocuses FHA to its core mission;
• Protects American taxpayers;
• Provides FHA and Ginnie Mae the tools to appropriately manage risk; and
• Provides liquidity to the housing finance system.
""FHA and Ginnie Mae should focus on helping families and individuals in their respective programs become sustainable homeowners while minimizing risk to the taxpayer to the greatest extent possible,"" said Brian Montgomery, FHA Commissioner and Assistant Secretary of Housing.
U.S. Treasury Secretary Steven Mnuchin also presented President Trump with a complementary housing finance reform plan today. Read Treasury's housing finance reform plan (https://home.treasury.gov/news/press-releases/sm769)."
09/06/2019:,https://archives.hud.gov//news/2019/pr19-133.cfm,HUD Reaches Voluntary Compliance and Conciliation Agreement with Los Angeles Housing Authority Settling Discrimination Claim,"WASHINGTON - The U.S. Department of Housing and Urban Development announced today that it has entered into a Conciliation/Voluntary Compliance Agreement with the Housing Authority of Los Angeles (HACLA), settling claims that it discriminated against a resident because of her sex and disabilities. Read the agreement.
The Fair Housing Act makes it unlawful to discriminate in housing because of race, color, national origin, religion, sex, disability, or familial status. This includes refusing to provide reasonable accommodations to persons with disabilities. In addition, Section 504 of the Rehabilitation Act of 1973 prohibits discrimination on the basis of disability under any program or activity receiving federal financial assistance. Title II of the Americans with Disabilities Act prohibits discrimination on the basis of disability in all programs, services, and activities of local governments.
""It is incumbent upon housing providers, especially those receiving federal funding, to treat all residents fairly,"" said Anna María Farías, HUD's Assistant Secretary for Fair Housing and Equal Opportunity. ""We are pleased that the Housing Authority of Los Angeles has agreed that, going forward, it will incorporate rental policies and practices that are consistent with the nation's fair housing laws.""
The case came to HUD's attention when a resident of the Housing Authority of Los Angeles filed a complaint alleging that HACLA discriminated against her on the basis of sex and disability. Specifically, the resident alleged that she asked to be transferred to another building to accommodate her disability, but the housing authority denied her request. The resident further alleged that for months she asked to be transferred, citing the need for an accommodation because of her disability. She also requested an emergency transfer under the Violence Against Women Act (VAWA) as a tenant in a covered housing program under that Act. After several more months, HACLA provided the resident with four transfer options, which she rejected because she believed that the alternative units were similarly unsafe and would not provide her with an accommodation for her disability. HACLA denies the claims but agreed to settle the resident's complaint.
Under the terms of this agreement, HACLA will pay the resident $35,000 and transfer her to another building. HACLA will also pay $15,000 to the Legal Aid Foundation of Los Angeles, which assisted the resident with filing her complaint, to cover attorneys' fees. In addition, certain HACLA employees will undergo training pertaining to fair housing, reasonable accommodations, and VAWA. HACLA will also amend its VAWA emergency transfer plan and reasonable accommodation procedures.
Persons who believe they have experienced discrimination may file a complaint by contacting HUD's Office of Fair Housing and Equal Opportunity at (800) 669-9777 (voice) or (800) 927-9275 (TTY)."
09/11/2019:,https://archives.hud.gov//news/2019/pr19-136.cfm,HUD Order Settles Claims of Discrimination Against Families with Children,"WASHINGTON - The U.S. Department of Housing and Urban Development (HUD) today announced the owners and managers of a single-family rental home in Nampa, Idaho, will pay $15,000 pursuant to a Consent Order resolving allegations that they violated the Fair Housing Act by refusing to rent the large home to a married couple because they have more than four children.
The Fair Housing Act makes it unlawful to deny or limit housing because a family has children under the age of 18, make statements that discriminate against families with children, and impose different rules, restrictions or policies on them.
""Persons attempting to provide a home for their family should not have their housing options limited because they have children,"" said Anna María Farías, HUD's Assistant Secretary for Fair Housing and Equal Opportunity. ""Today's action will hopefully serve as a reminder to all housing providers of the importance of meeting their obligations to comply with the requirements of the Fair Housing Act.""
""This Consent Order is another example of the important role HUD plays in enforcing the Fair Housing Act,"" said HUD General Counsel Paul Compton. ""Not only have we obtained relief for the family that was denied housing, but we have also educated housing providers about their responsibilities under the law.""
The Consent Order resolves a charge that HUD filed in May 2019, alleging that the homeowners discriminated against a family attempting to lease their 2,600 square foot, four-bedroom rental home because they have seven minor children. Specifically, HUD's charge alleges when the couple met with the property manager about renting the home, he told them that the owners had set a limit of four children for the home. The charge also alleges a policy restricting the number of children was written in the rental contract.
Under the Consent Order, the owners will pay $15,000 to the couple and their seven children. The owners also agreed to retain the services of a professional property management company to manage their rental properties, and they attended fair housing training following the filing of the couple's initial complaint.
Persons who believe they have experienced discrimination may file a complaint by contacting HUD's Office of Fair Housing and Equal Opportunity at (800) 669-9777 (Voice) or (800) 927-9275 (TTY). Housing discrimination complaints may also be filed by going to www.hud.gov/fairhousing, or by downloading HUD's free housing discrimination mobile application, which can be accessed through Apple devices, such as the iPhone, iPad, and iPod Touch."
09/12/2019:,https://archives.hud.gov//news/2019/pr19-137.cfm,HUD Charges Georgia Landlords with Discriminating Against Families with Children,"WASHINGTON - The U.S. Department of Housing and Urban Development (HUD) announced today that it is charging a couple that owns an apartment building in Richmond Hill, Georgia, with violating the Fair Housing Act by refusing to rent to, imposing different rental terms and conditions on, and making discriminatory statements about families with children. Read HUD's charge.
The Fair Housing Act makes it unlawful to discriminate against families with children under the age of eighteen. Housing may exclude children only if it meets the Fair Housing Act's exemption for housing for older persons.
""Landlords and property owners don't have the right to deny housing to families simply because they have children,"" said Anna Maria Farias, HUD's Assistant Secretary for Fair Housing and Equal Opportunity. ""HUD will continue to take appropriate action when individuals in the position to control access to housing fail to meet their responsibility to comply with the Fair Housing Act.""
""The Fair Housing Act generally prohibits landlords from limiting housing to families with a certain number of children. HUD is committed to enforcing the Act to ensure that families with children are given equal housing opportunities,"" said Paul Compton, HUD's General Counsel.
This case came to HUD's attention when Savannah-Chatham County Fair Housing Council and the mother of two minor children filed complaints alleging that Michael N. and Fonda W. Parker employed a policy limiting the number of children that could reside in their apartments. HUD's charge alleges that the Parkers' business voicemail recording announced the policy to persons who phoned looking for housing. The policy allows only one child in a two-bedroom unit and two children in a three-bedroom unit.
The charge will be heard by a United States Administrative Law Judge unless any party elects for the case to be heard in federal court. If the administrative law judge finds after a hearing that discrimination has occurred, he or she may award damages to the complainants for their loss as a result of the discrimination. The judge may also order other injunctive or equitable relief, as well as payment of attorney fees. In addition, the judge may impose civil penalties to vindicate the public interest."
09/16/2019:,https://archives.hud.gov//news/2019/pr19-138.cfm,"HUD Charges New York, Pennsylvania and Georgia-Based Housing Design and Construction Professionals with Discriminating Against Persons with Disabilities","WASHINGTON - The U.S. Department of Housing and Urban Development announced today that it is charging housing professionals based in New York, Pennsylvania and Georgia with discrimination for failing to design and construct the 40-unit North 8 Condominium development in Brooklyn, New York, in accordance with the accessibility requirements of the Fair Housing Act.
Named as respondents by HUD's charge are Toll Brothers, Inc.; Toll Land XIII Limited Partner; Lendlease (US) Construction LMB, Inc; Greenberg Farrow Architecture, Inc.; and 51 North 8th Street LP. Read HUD's charge.
The Fair Housing Act requires that multifamily housing built after March 1991 contain accessible features for persons with disabilities. This includes accessible common areas, bathrooms and kitchens, as well as wider doors and environmental controls that can be reached by residents who use wheelchairs. The failure to include these features is unlawful and makes the property difficult or impossible to use by people with disabilities.
""When developers and builders fail to construct housing that complies with the Fair Housing Act, they not only violate the law, they make it more difficult for persons with disabilities to obtain the accessible housing they need,"" said Anna María Farías, HUD's Assistant Secretary for Fair Housing and Equal Opportunity. ""Today's action reflects HUD's ongoing commitment to taking action when housing providers fall short of meeting their legal obligations.""
""The Fair Housing Act requires that housing built since 1991 contain basic features of accessibility. These features are less expensive to provide at the time of construction than after the building has been completed,"" said Paul Compton, HUD's General Counsel. ""HUD will continue to take action to bring inaccessible housing into compliance with the law.""
The case began when HUD's Assistant Secretary for Fair Housing and Equal Opportunity initiated a complaint after HUD staff found that the condominium complex failed to meet the design and construction requirements mandated by the Fair Housing Act. According to the charge, North8 Condominium lacks accessible routes and entrances into and through the common areas and units accessible kitchens and accessible bathrooms.
The charge will be heard by a United States Administrative Law Judge unless any party elects for the case to be heard in federal court. If the administrative law judge finds after a hearing that discrimination has occurred, he may award damages to individuals injured by the inaccessible housing. The judge may also order injunctive relief and other equitable relief, including retrofitting of the property, as well as payment of attorney fees. In addition, the judge may impose civil penalties in order to vindicate the public interest.
Persons who believe they have experienced discrimination may file a complaint by contacting HUD's Office of Fair Housing and Equal Opportunity at (800) 669-9777 (voice) or (800) 927-9275 (TTY)."
09/18/2019:,https://archives.hud.gov//news/2019/pr19-140.cfm,HUD and Census Bureau Report Residential Construction Activity in August 2019,"U.S. Dept. of Housing and Urban Development Office of Public Affairs (202) 708-0685 September 18, 2019
WASHINGTON - The U.S. Department of Housing and Urban Development (HUD) and the U.S. Census Bureau jointly announced the following new residential construction statistics for August 2019.

Building Permits
Privately owned housing units authorized by building permits in August were at a seasonally adjusted annual rate of 1,419,000. This is 7.7 percent (±1.2 percent) above the revised July rate of 1,317,000 and is 12.0 percent (±1.6 percent) above the August 2018 rate of 1,267,000. Single-family authorizations in August were at a rate of 866,000; this is 4.5 percent (±0.8 percent) above the revised July figure of 829,000. Authorizations of units in buildings with five units or more were at a rate of 509,000 in August.
Housing Starts
Privately owned housing starts in August were at a seasonally adjusted annual rate of 1,364,000. This is 12.3 percent (±10.2 percent) above the revised July estimate of 1,215,000, but is 6.6 percent (±11.6 percent)* above the August 2018 rate of 1,279,000. Single-family housing starts in August were at a rate of 919,000; this is 4.4 percent (±10.3 percent)* above the revised July figure of 880,000. The August rate for units in buildings with five units or more was 424,000.
Housing Completions
Privately-owned housing completions in August were at a seasonally adjusted annual rate of 1,294,000. This is 2.4 percent (±11.5 percent)* above the revised July estimate of 1,264,000 and is 5.0 percent (±11.2 percent)* above the August 2018 rate of 1,232,000. Single-family housing completions in August were at a rate of 945,000; this is 3.7 percent (±10.5 percent)* above the revised July rate of 911,000. The August rate for units in buildings with five units or more was 338,000.
Read more about new residential construction activity (www.census.gov/construction/nrc/index.html).
EXPLANATORY NOTES
In interpreting changes in the statistics in this release, note that month-to-month changes in seasonally adjusted statistics often show movements which may be irregular. It may take three months to establish an underlying trend for building permit authorizations, six months for total starts, and six months for total completions. The statistics in this release are estimated from sample surveys and are subject to sampling variability as well as nonsampling error including bias and variance from response, nonreporting, and undercoverage. Estimated relative standard errors of the most recent data are shown in the tables. Whenever a statement such as ""2.5 percent (±3.2 percent) above"" appears in the text, this indicates the range (-0.7 to +5.7 percent) in which the actual percentage change is likely to have occurred. All ranges given for percentage changes are 90 percent confidence intervals and account only for sampling variability. If a range does not contain zero, the change is statistically significant. If it does contain zero, the change is not statistically significant; that is, it is uncertain whether there was an increase or decrease. The same policies apply to the confidence intervals for percentage changes shown in the tables. On average, the preliminary seasonally adjusted estimates of total building permits, housing starts and housing completions are revised 3 percent or less. Explanations of confidence intervals and sampling variability can be found at the Census Bureau's website (www.census.gov/construction/nrc/how_the_data_are_collected/index.html).
* The 90 percent confidence interval includes zero. In such cases, there is insufficient statistical evidence to conclude that the actual change is different from zero."
09/18/2019:,https://archives.hud.gov//news/2019/pr19-141.cfm,Secretary Ben Carson Implores California Leaders to Address Homelessness Crisis,"LOS ANGELES - Today Secretary Ben Carson wrote to state and local leaders in California asking them to re-evaluate the policies that are fueling the homeless crisis in many major cities across the state.
Secretary Carson's letter is in response to a request for additional Federal funding from leaders in the delegation. In his letter, Secretary Ben Carson provided an update on the comprehensive approve the Trump Administration is taking to address the issue of homelessness. ""Homelessness is devastating for our most vulnerable populations and ending it has been a top priority of the Trump Administration,"" Secretary Carson wrote. Almost half of all unsheltered homeless people in the United States are in California, a level about four times as high as California's share of the overall U.S. population.
Read the full letter here."
09/19/2019:,https://archives.hud.gov//news/2019/pr19-139.cfm,HUD Awards Choice Neighborhoods Planning Grants,"WASHINGTON - Expanding on its commitment to help local communities redevelop severely distressed HUD assisted housing and revitalize neighborhoods, the U.S. Department of Housing and Urban Development (HUD) today awarded more than $5 million to four communities.
Funded through HUD's Choice Neighborhoods program, these grants will help local leaders to craft comprehensive, homegrown plans to revitalize and transform these neighborhoods.
HUD is awarding Choice Neighborhood Planning grants to the following communities:
Read local summaries of the grants announced today.
HUD's Choice Neighborhoods program promotes a comprehensive approach to transforming neighborhoods struggling to address the interconnected challenges of distressed housing, inadequate schools, poor health, high crime, and historic disinvestment. Choice Neighborhoods is focused on three core goals:
Housing: Replace distressed public and assisted housing with high-quality mixed-income housing that is well-managed and responsive to the needs of the surrounding neighborhood. People: Improve outcomes of households living in the target housing related to employment and income, health, and children's education; and Neighborhood: Create the conditions necessary for public and private reinvestment in distressed neighborhoods to offer the kinds of amenities and assets, including safety, good schools, and commercial activity, that are important to families' choices about their community.
• Housing: Replace distressed public and assisted housing with high-quality mixed-income housing that is well-managed and responsive to the needs of the surrounding neighborhood.
• People: Improve outcomes of households living in the target housing related to employment and income, health, and children's education; and
• Neighborhood: Create the conditions necessary for public and private reinvestment in distressed neighborhoods to offer the kinds of amenities and assets, including safety, good schools, and commercial activity, that are important to families' choices about their community.
Through Choice Neighborhoods Planning Grants, local governments, housing authorities, residents, nonprofits, tribal authorities, private developers, school districts, police departments, and other civic organizations create a common vision and develop effective strategies to revitalize their neighborhood. The resulting Transformation Plan lays the foundation for revitalizing the distressed public and/or assisted housing units, transforming the surrounding neighborhood, and promoting opportunities for families.
In addition, grantees may use a portion of these funds for “Action Activities” to build momentum and attract additional investment. Eligible uses of these funds include recycling vacant property into community gardens, pocket parks, or farmers markets; beautification, place-making and community arts projects; homeowner and business façade improvement programs; neighborhood broadband or wi-fi; fresh food initiatives; and gap financing for economic development projects."
09/20/2019:,https://archives.hud.gov//news/2019/pr19-142.cfm,HUD Awards $1 Million to Improve the Main Streets in Two Communities,"WASHINGTON - The U.S. Department of Housing and Urban Development (HUD) today is awarding $1 million to help build affordable housing in Arkansas and Oklahoma. The City of Batesville in Arkansas will receive a $500,000 grant to redevelop The Adler Building and the City of Thomas in Oklahoma will receive $ 500,000 to rehabilitate commercial space into residential units in the city's commercial district. The grants are funded through HUD's HOPE VI Main Street Program.
The City of Batesville, Arkansas will redevelop ""The Adler Building,"" located on West Main Street. Built in 1881, this is one of the oldest surviving buildings in Arkansas' oldest surviving town. The first floor of the building originally served as a general store, and the second floor was an Opera Hall, used for socializing and community events. This grant will be used to renovate the building to include affordable residential units and two commercial units. Two of the units will be set aside for very low income families (50 percent or below of Area Median Income).
Batesville, Arkansas is also located within a federal Opportunity Zone, a designation intended to stimulate long-term private investment in low-income urban and rural communities by allowing investors to realize significant federal tax benefits through investing capital gains in Qualified Opportunity Funds.
The City of Thomas, Oklahoma will use the funding to rehabilitate six residential units above six historic buildings in the City's core commercial district. These units were previously residential but are no longer because they have fallen into disrepair. The City of Thomas currently only has a total of 11 affordable housing units, and the City is eager to increase this number.
""Main Street grants not only provide affordable housing, but they also increase economic opportunities, including in Opportunity Zones,"" said HUD Secretary Ben Carson. ""HUD is proud to be a partner to rebuild and transform communities like Thomas and Batesville into vibrant and sustainable neighborhoods.""
HUD's Main Street program seeks to rejuvenate older, downtown business districts while retaining the area's traditional and historic character by providing grants to smaller communities for the development of affordable housing. Such communities must have an ongoing Main Street revitalization effort. Under Main Street, obsolete commercial offices or buildings can be reconfigured into rent producing affordable housing.
Background on Opportunity Zones
President Trump signed the 2017 Tax Cuts and Jobs Act, creating Opportunity Zones to stimulate long-term investments in low-income communities. Opportunity Zones offer capital gains tax relief to those who invest in these distressed areas. This initiative is anticipated to spur $100 billion in private capital investment in Opportunity Zones. Incentivizing investment in low-income communities fosters economic revitalization, job creation, and promotes sustainable economic growth across the nation, especially in communities HUD serves. Read more about Opportunity Zones.
Opportunity Zones are a powerful vehicle for bringing economic growth and job creation to the American communities that need it the most. On average, the median family income in an Opportunity Zone is 37 percent below its respective state median. Overall, more than 8,700 communities in all 50 States, Washington D.C., and five U.S. territories have been designated as Opportunity Zones. Nearly 35 million Americans live in communities designated as Opportunity Zones."
