Date,URL,Title,Text
06/25/2019:,https://archives.hud.gov//news/2019/pr19-096.cfm,HUD Secretary Ben Carson to Chair White House Council on Affordable Housing,"WASHINGTON - Today, President Donald Trump signed an Executive Order establishing the White House Council on Eliminating Barriers to Affordable Housing, and named Housing and Urban Development (HUD) Secretary Ben Carson as its chairperson.
The Council will consist of members across eight Federal agencies and engage with State, local, and tribal leaders across the country to identify and remove the obstacles that impede the production of affordable homes – namely, the enormous price tag that follow burdensome government regulations.
""With the signing of today's Executive Order, President Trump is prescribing a powerful treatment that correctly diagnoses the source of America's affordable housing condition: this is a matter of supply and demand, and we have to increase the supply of affordable homes by changing the cost side of the equation,"" said Secretary Carson. ""Increasing the supply of housing by removing overly burdensome rules and regulations will reduce housing costs, boost economic growth, and provide more Americans with opportunities for economic mobility.""
Research indicates that more than 25% of the cost of a new home is the direct result of Federal, State, and local regulations. For this reason, in recent years, the construction of new multifamily and single-family dwellings has not kept pace with the formation of new households. Census Bureau data indicates that from 2010 to 2016, only seven homes were built for every 10 households formed. As a result, Americans have fewer housing opportunities, including the opportunity to achieve sustainable homeownership, which is the number one builder of wealth for most American families.
To curtail burdensome regulations, the Council will be tasked with accomplishing the following items by January 2021:
• Work across agencies, States, local governments, tribal governments, and private-sector stakeholders to identify policies that artificially increase the cost of developing affordable housing.
• Report on the quantifiable effect that Federal, State, local, and tribal regulatory barriers have on affordable housing development, the economy, and society.
• Take action to reduce Federal regulatory and administrative burdens that discourage private investment and housing development;
• Take action within existing Federal programs to align and support local, and tribal state efforts to reduce regulatory and administrative burdens that discourage housing development.
• Recommend Federal, State, local, and tribal policies that would: Reduce and streamline statutory, regulatory, and administrative burdens that inhibit the development of affordable housing supply at all levels of government; Incentivize State, local, and tribal governments to reduce barriers to affordable housing development.
Reduce and streamline statutory, regulatory, and administrative burdens that inhibit the development of affordable housing supply at all levels of government; Incentivize State, local, and tribal governments to reduce barriers to affordable housing development.
• Reduce and streamline statutory, regulatory, and administrative burdens that inhibit the development of affordable housing supply at all levels of government;
• Incentivize State, local, and tribal governments to reduce barriers to affordable housing development."
06/27/2019:,https://archives.hud.gov//news/2019/pr19-097.cfm,HUD Offers Record $330 Million to Clean Up Dangerous Lead and Other Hazards in Housing,"WASHINGTON - The U. S. Department of Housing and Urban Development today announced a record $330 million in grants to clean up lead-based paint hazards and other housing-related health and safety hazards in low-income housing.
Click here (www.youtube.com/watch?v=oN1zWgZ7eUs&feature=youtu.be) or on the video below to view Secretary Carson talking about the importance of this grant award.
These grants are provided through HUD's Lead Hazard Reduction (www.grants.gov/web/grants/search-grants.html?keywords=FR-6300-N-13) and Healthy Homes Production for Tribal Housing (www.grants.gov/web/grants/search-grants.html?keywords=FR-6200-N-44) grant programs and will direct critical funds to qualifying cities, counties, states and Native American tribal governments to eliminate dangerous lead paint hazards. Additionally, HUD has added a category of cities and counties that have ""high impact neighborhoods"" with high concentrations of both pre-1940 housing, low-income families, and high rates of young children with elevated blood lead levels.
""Your home is a haven from the outside world. You shouldn't be worried about the hidden dangers that could affect you and your family,"" said Secretary Ben Carson. ""Housing conditions directly affect the health of its residents. Grants like these will help communities around the nation protect themselves from the danger of lead exposure and other health and safety hazards.""
Matthew Ammon, Director of HUD's Office of Lead Hazard Control and Healthy Homes, added, ""By providing these grants, HUD makes it clear that providing healthy and safe homes for the community is a priority. A key part of having a healthy home is maintaining your own health. HUD is committed to protecting families from these hazards and providing healthy and sustainable housing.""
Through these grants programs, HUD's Office of Lead Hazard Control and Healthy Homes promotes local efforts to eliminate dangerous lead hazards from lower income homes, stimulates private sector investment in lead hazard control, and educates the public about the dangers of lead-based paint.
Lead Hazard Control Grant Programs
Although lead-based paint was banned for residential use in 1978, HUD estimates that about 24 million homes built before then still have significant lead-based paint hazards today. Lead-contaminated dust is the primary cause of lead exposure and can lead to a variety of health problems in young children, including reduced IQ, learning disabilities, developmental delays, reduced height, and impaired hearing. At higher levels, lead can damage a child's kidneys and central nervous system and cause anemia, coma, convulsions and even death.
HUD is making grants available through the following programs:
Lead Hazard Reduction: $324 Million
The purpose of this program is to maximize the number of children under the age of six years protected from lead poisoning by assisting grantees in undertaking comprehensive programs to identify and control lead-based paint hazards in eligible privately-owned target housing. This year, HUD has added a category of cities and counties that have ""high impact neighborhoods"" with high concentrations of [both] pre-1940 housing, low-income families, and [high rates of] young children with elevated blood lead levels. These five-year grants will be for up to $9.1 million each. In the second grant category, HUD will award 42-month grants of up to $5 million each for controlling lead-based paint hazards in communities with large numbers of occupied pre-1940 rental housing. Other eligible applicants may apply to do this lead hazard control work with 42-month grants of up to $4 million each. Applicants that have never had a HUD lead hazard control grant are eligible for a 42-month grant of up to $3 million each. Application due date: Friday, August 9, 2019.
Healthy Homes Production for Tribal Housing: $12 Million
This program assists American Indian and Alaska Native tribal governments to develop comprehensive programs to identify and remediate housing issues that contribute to health and safety issues in tribal communities. The grant program takes a comprehensive approach to addressing multiple childhood diseases and injuries by focusing on housing-related hazards in a coordinated fashion, rather than addressing a single hazard at a time. The estimated total for this program is $12 million with grants up to one million each. Application due date: Friday, August 9, 2019."
07/02/2019:,https://archives.hud.gov//news/2019/pr19-098.cfm,HUD Offers $150 Million to Provide Affordable Housing to People with Disabilities,"WASHINGTON - The U.S. Department of Housing and Urban Development (HUD) is offering $150 million in grants to provide affordable housing to approximately 18,000 non-elderly persons living with disabilities. Read HUD's funding notice.
HUD's Mainstream Housing Choice Voucher Program provides funding to public housing agencies to assist non-elderly persons with disabilities. Agencies are encouraged to partner with health and human service organizations to provide participants with supportive services.
""Making sure people with disabilities have a decent, safe, and affordable place to call home is essential,"" said HUD Secretary Ben Carson. ""This funding will help our local partners ensure residents with disabilities have the opportunity to fully enjoy their home while living independently.""
Targeting housing resources to assist eligible persons with disabilities and their families who are currently experiencing homelessness, have previously experienced homelessness, or at-risk of experiencing homelessness supports the goals of Home Together: The Federal Strategic Plan to Prevent and End Homelessness (www.usich.gov/resources/uploads/asset_library/Home-Together-Federal-Strategic-Plan-to-Prevent-and-End-Homelessness.pdf).
HUD anticipates awarding 300 grants ranging from $20,000 up to $3 million to eligible public housing agencies. Applications are due on Thursday, September 5, 2019."
07/03/2019:,https://archives.hud.gov//news/2019/pr19-099.cfm,HUD Makes Record $2.3 Billion Available to Support Thousands of Local Homeless Programs,"WASHINGTON - In a continuing effort to prevent and end homelessness, the U.S. Department of Housing and Urban Development (HUD) today is making a record $2.3 billion available to support thousands of local homeless assistance programs nationwide. Read HUD's Notice of Funding Availability (NOFA).
HUD's Continuum of Care homeless assistance grants support a wide variety of local programs from street outreach and assessment programs to transitional and permanent housing for individuals, including, veterans, youth, families, and persons experiencing long-term or chronic homelessness.
""While housing first is critical and necessary to place our most vulnerable on a path to self-sufficiency, we should be mindful not to define success as a Washington routine to check a box, shelter someone - indefinitely - and ask for more money the next year,"" said HUD Secretary Ben Carson. ""We want to ensure that awards are granted to programs that prove to be successful in a meaningful way based on an evidence-based performance.""
""Today we announce another historic investment to house and serve our most vulnerable neighbors living in our shelters and, too frequently, on our streets,"" said David C. Woll, Jr., HUD Principal Deputy Assistant Secretary, Office of Community Planning and Development. ""HUD will continue to work closely with our local partners to support those programs that are proving most effective in reducing and even ending homelessness in their neighborhoods.""
Through the Continuum of Care grant competition, HUD is encouraging communities to pursue evidence-based approaches to end veteran, chronic, family, and youth homelessness and to use their data to strategically target their available resources to end homelessness. To help communities reach these goals, there is greater flexibility provided to create a variety of new projects that will allow recipients to serve different populations of individuals and families experiencing homelessness as well as to support increased data collection and analysis.
HUD requires prospective grantees to submit applications electronically at https://esnaps.hud.gov/. Any changes to HUD-published funding notices will published in the Federal Register and will be made available on HUD's website (www.hudexchange.info/programs/e-snaps/fy-2019-coc-program-nofa-coc-program-competition/#nofa-and-notices). The deadline for Fiscal Year 2019 Continuum of Care grant applications is September 30, 2019 by 8:00 PM ET."
07/09/2019:,https://archives.hud.gov//news/2019/pr19-100.cfm,HUD to Collaborate with Private Sector on Opportunity Zones Challenge,"WASHINGTON - The U.S. Department of Housing and Urban Development (HUD) announced the Department will co-lead an Opportunity Zone-focused workforce challenge of the U.S. Census Bureau's ""The Opportunity Project (TOP)"" initiative. TOP is a unique and innovative accelerator program that matches tech companies, universities, government, and communities together to create useful digital products for the public. The summer of 2019 challenge-which will be co-led by the Council of Economic Advisers (CEA)-is entitled ""Catalyzing Investment in Opportunity Zones,"" with the purpose of creating ""digital tools and resources to connect investors with community leaders, entrepreneurs, and workers"" of the nation's Opportunity Zones. Read more about the TOP initiative (https://opportunity.census.gov/sprints).
""HUD is pleased that leading innovators from across the country are directly taking on the challenge of developing products to help people invest in Opportunity Zones,"" Secretary Ben Carson said. ""We also want to thank the Census Bureau and the other agencies participating in this summer's Opportunity Project. Working together, we collaborate with the private sector to solve some of the most pressing issues facing Americans in economically distressed areas. This project will help ensure that Opportunity Zone stakeholders have access to the best data, innovation, and expertise as investment continues to flow into these underserved areas.""
""Government, the technology industry, and the communities that comprise Opportunity Zones all have a significant role to play in establishing new products and services that can benefit the Americans who need them most,"" said Scott Turner, Executive Director of the White House Opportunity and Revitalization Council.
The Opportunity Project utilizes the expertise of professionals from across government, the technology sector, and private business to focus on a specific challenge during designated 'sprints.' The final products will be shared in Washington, D.C. in December 2019.
The Opportunity Challenge is a part of the work Secretary Carson is undertaking as the Chair of the White House Opportunity and Revitalization Council. The Council's 16 Federal member agencies and Federal-State partnerships are engaging with governments at all levels-State, local, tribal, and Territorial- and the private sector on ways to more effectively use taxpayer dollars to revitalize low-income communities.
President Trump signed the 2017 Tax Cuts and Jobs Act, creating Opportunity Zones to stimulate long-term investments in low-income communities. The program offers capital gains tax relief to those who invest in these distressed areas. This program is anticipated to spur $100 billion in private capital investment in Opportunity Zones. Incentivizing investment in low-income communities fosters economic revitalization, job creation, and promotes sustainable economic growth across the nation, especially in communities HUD serves. Read more about Opportunity Zones (www.irs.gov/newsroom/tax-reform-creates-opportunity-zone-tax-incentive).
Opportunity Zones are a powerful vehicle for bringing economic growth and job creation to the American communities that need it the most. On average, the median family income in an Opportunity Zone is 37 percent below the state median. Overall, more than 8,700 communities in all 50 States, Washington D.C., and five U.S. territories have been designated as Opportunity Zones. Nearly 35 million Americans live in communities designated as Opportunity Zones."
07/10/2019:,https://archives.hud.gov//news/2019/pr19-101.cfm,HUD Charges Texas Landlords with Race Discrimination,"WASHINGTON - The U.S. Department of Housing and Urban Development (HUD) today announced that it is charging Plano, Texas, landlords Quang Dangtran and his wife, Ha Nguyen, with violating the Fair Housing Act by refusing to lease a room to a prospective tenant because she is black. Read HUD's charge.
The Fair Housing Act makes it illegal to discriminate in housing because of race or color, which includes making discriminatory statements with respect to the rental of a dwelling.
""A person's race should never determine whether or not they have access to a place to call home,"" said Anna Maria Farias, HUD's Assistant Secretary for Fair Housing and Equal Opportunity. ""Today's action reflects HUD's ongoing commitment to taking appropriate action when the Fair Housing Act has been violated.""
HUD's charge alleges that in advertising on craigslist for a room in a five-bedroom house, Mr. Dangtran required applicants to identify their race and submit a photograph of themselves. When Complainant, a woman who had expressed an interest in renting, contacted Mr. Dangtran about the rental, he reiterated his request for a picture or ""selfie"". HUD's charge further alleges that although the woman refused, Dangtran later agreed to meet her at the house but when he saw that she is black, he refused to show her the room, stating that her race would make his wife and the other tenants uncomfortable.
""In 2019, more than 50 years after enactment of the Fair Housing Act, it should be universally known and accepted that racial discrimination in housing is illegal and unacceptable,"" said Paul Compton, HUD's General Counsel. ""When HUD becomes aware of such discrimination, it will aggressively pursue remedies provided for by law.""
HUD's charge will be heard by a United States Administrative Law Judge unless any party elects for the case to be heard in federal court. If the administrative law judge finds after a hearing that discrimination has occurred, he may award damages to the complainant for her loss as a result of the discrimination. The judge may also order injunctive relief and other equitable relief, as well as payment of attorney fees. In addition, the judge may impose civil penalties in order to vindicate the public interest.
People who believe they have experienced discrimination may file a complaint by contacting HUD's Office of Fair Housing and Equal Opportunity at (800) 669-9777 (voice) or (800) 927-9275 (TTY). Housing discrimination complaints may also be filed by going to hud.gov/fair housing, or by downloading HUD's free housing discrimination mobile application, which can be accessed through Apple and Android devices."
07/11/2019:,https://archives.hud.gov//news/2019/pr19-102.cfm,HUD Charges Maine Apartment Owner with Discrimination for Denying Assistance Animal to Veteran with Disabilities,"WASHINGTON - The U.S. Department of Housing and Urban Development (HUD) announced today that it is charging Roderick Apartments, LLC in Clinton, Maine, and one of its agents with discrimination for denying a veteran with disabilities the right to keep his assistance animal. Read HUD's charge.
The Fair Housing Act prohibits housing providers from denying or limiting housing to people with disabilities, or from refusing to make reasonable accommodations in policies or practices for people with disabilities. This includes not allowing people with disabilities (impairments that substantially limit major life activities) to have assistance animals that perform work or tasks, or that provide disability-related emotional support.
""No person with a disability should be denied the accommodation they need, especially individuals who served in the Armed Forces to defend our freedom,"" said Anna María Farías, HUD's Assistant Secretary for Fair Housing and Equal Opportunity. ""HUD will continue to work to ensure that housing providers meet their obligation to comply with this nation's fair housing laws.""
The case came to HUD's attention when a veteran with disabilities filed a complaint alleging that Roderick Apartments refused to lease an apartment to him because he uses a dog as an assistance animal. HUD's Charge alleges that tests subsequently conducted by Pine Tree Legal Assistance (PTLA), a nonprofit agency that provides free civil and legal assistance to low- income Maine residents, confirmed Roderick Apartments' policy of refusing to rent to persons with an assistance animal. In one test, a PTLA tester posing as an apartment seeker who uses an assistance animal allegedly was told that having the animal would be grounds for eviction.
""Fair Housing Act charges on the basis of disability demonstrate HUD's continued commitment to ensuring that housing providers offer equal opportunities to all persons looking to rent a home,"" said Paul Compton, HUD's General Counsel.
HUD's charge will be heard by a United States Administrative Law Judge unless any party elects for the case to be heard in federal court. If the administrative law judge finds after a hearing that discrimination has occurred, he may award damages to the complainant for his loss as a result of the discrimination. The judge may also order injunctive relief and other equitable relief, as well as payment of attorney fees. In addition, the judge may impose civil penalties in order to vindicate the public interest.
People who believe they have experienced discrimination may file a complaint by contacting HUD's Office of Fair Housing and Equal Opportunity at (800) 669-9777 (voice) or (800) 927-9275 (TTY). Housing discrimination complaints may also be filed by going to hud.gov/fair housing, or by downloading HUD's free housing discrimination mobile application, which can be accessed through Apple and Android devices."
07/11/2019:,https://archives.hud.gov//news/2019/pr19-103.cfm,HUD Announces Winners of 2019 Healthy Homes Award,"WASHINGTON - The U.S. Department of Housing and Urban Development (HUD) and the National Environmental Health Association (NEHA) today announced that two model programs are recipients of the HUD Secretary's Award for Healthy Homes, an award recognizing excellence in making indoor environments healthier for residents. The awards were presented today at NEHA's 2019 Annual Educational Conference and Exhibition in Nashville, Tennessee.
For the fifth consecutive year, HUD and NEHA identified outstanding local programs that promote public housing/multifamily housing, and policy and education innovation. This year's recipients are:
• City of Rochester, New York, Certificate of Occupancy and Lead Inspection Program (Policy and Education Innovation)
• Partnership between the American Association of Radon Scientists and Technologists in North Carolina and HUD Multifamily Program
""HUD congratulates these recipients for the diverse nature of their programs,"" said HUD Secretary Benjamin Carson. ""These programs demonstrate the power of partner driven approaches and need for holistic action that lead to real changes in underserved communities. This kind of collaboration across different disciplines can address health and safety related problems before they negatively impact our residents, especially children.""
HUD partners with NEHA based on creating healthier homes environments for residents, by working across the housing, health, and environmental sectors. The award, initiated in 2015, showcases results achieved under housing and indoor environmental health programs. Nominations were submitted by regional, city and county governments, healthcare and housing providers, advocacy organizations, academic institutions, community-based organizations, and trade associations, among others.
The criteria for the awards include measurability, health impact on population, economic sustainability, policy/program innovation, impact on physical environment, and partnership/collaboration. A panel of volunteer judges from NEHA evaluated entries. For more information about the award process, please visit NEHA's website at www.neha.org/about-neha/awards.
Next year's awards will be presented during the NEHA Annual Educational Conference and Exhibition. For more information about HUD's Office of Lead Hazard Control and Healthy Homes, please visit www.hud.gov/healthyhomes.
The awardees' project summaries are below:
City of Rochester, New York Certificate of Occupancy and Lead Inspection Program
The City of Rochester has a long history of adopting and implementing proactive code enforcement programs. Two programs that have had the greatest impact on the health and safety of residents are the Renewable Certificate of Occupancy (C of O) Program and the Lead-Based Paint Poisoning Prevention Ordinance. These programs, when combined with the efforts of the City's community partners, have reduced the number of children with elevated blood levels by 99% since 1994 and by 85% since the adoption of the lead ordinance in 2005. This has made a measurable difference in the lives of Rochester's children.
Partnership Between American Association of Radon Scientists and Technologists (AARST) in North Carolina and HUD Multifamily Program
The partnership between the American Association of Radon Scientists and Technologists, a non-profit organization, and the HUD Multifamily Program involved implementing and strengthening the HUD Office of Multifamily Development Radon Policy issued in 2013. The policy is a vital component of the multifamily program at HUD, enjoying strong support from radon professionals and other stakeholders. Since its issuance, AARST and HUD Multifamily have partnered multiple times to educate HUD personnel, radon professionals, lenders and other stakeholders about the policy and how it can best be implemented, through webinars, articles in publications, presentations at conferences, and other methods."
