Date,URL,Title,Text
01/08/2019:,https://archives.hud.gov//news/2019/pr19-001.cfm,FHA Calls on Lenders to Assist Federal Workers and Contractors Impacted by the Federal Government Shutdown,"WASHINGTON - The Federal Housing Administration (FHA) today called on all approved mortgagees and lenders to be sensitive to the financial hardships experienced by borrowers as a result of the shutdown, including those borrowers subject to furlough, layoff, or a reduction in income related to the shutdown. Read FHA Commissioner Brian Montgomery's letter to lenders and approved mortgagees.
FHA approved mortgagees and lenders are reminded of their ongoing obligation to offer special forbearance to borrowers experiencing loss of income.
FHA expects all approved mortgagees and lenders to make every effort to communicate with and assist affected borrowers to the greatest extent possible by:
extending special forbearance plans to borrowers impacted by the shutdown, and fully evaluating borrowers for available loss mitigation options to avoid foreclosure whenever possible.
• extending special forbearance plans to borrowers impacted by the shutdown, and
• fully evaluating borrowers for available loss mitigation options to avoid foreclosure whenever possible.
""In accordance with longstanding policy, FHA expects mortgagees to assist borrowers experiencing a loss of income,"" said FHA Commissioner Brian Montgomery in a letter to FHA-approved lenders and mortgagees.
FHA is also strongly encouraging all approved mortgagees and lenders to waive late fees for affected borrowers and to suspend credit reporting on borrowers nationwide who have been affected by the shutdown."
01/09/2019:,https://archives.hud.gov//news/2019/pr19-002.cfm,Ginnie Mae Executive Vice President Bright Steps Down,"WASHINGTON - The Department of Housing and Urban Development (HUD) and the Government National Mortgage Association (Ginnie Mae) today announced Executive Vice President and Chief Operations Officer Michael Bright will be stepping down on January 16 and has requested that his nomination for President of Ginnie Mae be withdrawn to pursue a new opportunity in the private sector.
In a resignation letter to Housing and Urban Development Secretary Ben Carson, Bright wrote:
The opportunity to serve the country and our economy in this capacity has been a tremendous honor... I am incredibly proud of what we have accomplished since early 2017. As you are aware, over the past two years, Ginnie Mae's total outstanding portfolio crossed the $2 trillion mark, and last year we served 1.9 million American families as they purchased or refinanced a home. This would not have taken place without the dedication and leadership of the Ginnie Mae staff, who are some of the most knowledgeable and mission-focused professionals I have ever worked with.
""I want to thank Michael for his many contributions to Ginnie Mae over the last two years,"" said Secretary Carson. ""He has assembled a first-rate team and successfully managed and expanded a portfolio that enables millions of Americans to become homeowners each year. We wish him the best in his future.""
Maren Kasper, current Executive Vice President of Ginnie Mae, will serve as the Acting President upon Bright's departure. Kasper joined Ginnie Mae in June 2017.
As announced (https://ginniemae.gov/newsroom/Pages/PressReleaseDispPage.aspx?ParamID=149) on December 22, 2018, during a lapse in government funding, Ginnie Mae will continue to remit timely payment of principal and interest to investors. There will also be no disruption of essential functions, including the granting of commitment authority and support for continued issuance of Ginnie Mae-guaranteed Mortgage Backed Securities (MBS) and Real Estate Mortgage Investment Conduits (REMICs)."
01/26/2019:,https://archives.hud.gov//news/2019/pr19-003.cfm,HUD Renews Funding to Thousands of Local Homeless Programs,"WASHINGTON - The U.S. Department of Housing and Urban Development (HUD) today awarded approximately $2 billion to renew support to thousands of local homeless assistance programs across the nation. HUD's Continuum of Care grants will provide critically needed support to 5,800 local programs on the front lines of serving individuals and families experiencing homelessness. View a complete list of all the state and local homeless projects awarded funding (www.hudexchange.info/programs/coc/awards/).
HUD is today announcing renewal funding for previously funded local programs. The agency will announce new project awards at a later date.
""At this time of year, thousands of local homeless assistance providers receive federal funding to operate and maintain stable housing for those living in our shelter system and on our streets,"" said HUD Secretary Ben Carson. ""Renewing these grants will come as a huge relief to these providers, and it will allow them to continue their work to house and serve our most vulnerable neighbors.""
HUD Continuum of Care grant funding supports a broad array of interventions designed to assist individuals and families experiencing homelessness, particularly those living in places not meant for habitation, located in sheltering programs, or at imminent risk of becoming homeless. Each year, HUD serves more than a million people through emergency shelter, transitional, and permanent housing programs.
HUD continues to challenge state and local planning organizations called ""Continuums of Care"" to support their highest performing local programs that have proven most effective in meeting the needs of persons experiencing homelessness in their communities. Many of these state and local planners also embraced HUD's call to shift funds from existing underperforming projects to create new ones that are based on best practices that will further their efforts to prevent and end homelessness.
Last December, local communities reported homelessness in the U.S. remained largely unchanged in 2018. Based upon these local reports, HUD's 2018 Annual Homeless Assessment Report to Congress (www.hudexchange.info/resources/documents/2018-AHAR-Part-1.pdf) found that 552,830 persons experienced homelessness on a single night in 2018, an increase of 0.3 percent since 2017. The number of families with children experiencing homelessness declined 2.7 percent since 2017 and 29 percent since 2010. Local communities also reported a continuing trend in reducing veteran homelessness across the country - the number of veterans experiencing homelessness fell 5.4 percent since January 2017 and by 49 percent since 2010.
The renewal grants HUD is awarded include (View a complete list of all the state and local homeless projects (www.hudexchange.info/programs/coc/awards/)):"
01/31/2019:,https://archives.hud.gov//news/2019/pr19-004.cfm,HUD Secretary Carson Announces Agreement to Address Longstanding Issues at NYCHA,"WASHINGTON - U.S. Housing and Urban Development (HUD) Secretary Ben Carson today announced an agreement with the City of New York and the New York City Housing Authority (NYCHA) to provide a new roadmap forward for NYCHA that will address the longstanding issues at the housing authority’s properties. Read the agreement.
""The families who have endured unimaginably poor housing conditions deserve better from their housing authority,"" said Secretary Carson. ""Today we are presenting NYCHA residents with bold new solutions for decades-old problems.""
The agreement, made under the authority of Secretary Carson and not subject to court approval, establishes specific requirements and milestones to address the serious health and safety hazards at NYCHA properties, including lead-based paint, mold, heat, vermin, among others. It also recognizes the existence of a substantial default by NYCHA but does not impose a receiver.
As part of the agreement, the City is committing at least $2.2 billion in funding over the next 10 years to address these issues. HUD will continue to provide funding to NYCHA, which is estimated to be $1.5 billion this year.
The agreement also establishes a federal monitor selected by HUD and the Southern District of New York (SDNY) with input from the City. The monitor will submit quarterly reports to HUD and SDNY, which will be made publicly available. The City will pay the cost of the monitor in addition to its other financial commitments. The parties expect to announce the monitor in the near future.
In addition, the plan meets the following key principles as required by HUD in December 2018 when Secretary Carson agreed to work with Mayor Bill de Blasio to reach an agreement to avoid receivership:
A sustainable commitment to decent, safe and sanitary affordable housing using all tools available Setting specific performance targets for lead, mold, elevator, heat and vermin issues Robust oversight to assure remediation objectives are met Milestones for measuring meaningful progress toward remediation goals and other institutional improvements at NYCHA Reduction of unwarranted costs and elimination of bureaucratic impediments to efficient operations Management of the highest quality and commitment Local control of day-to-day operations by NYCHA and New York City Strong remedies that are immediately available to address any future failure to perform, whether in the case of individuals or organizational structures Commitment of all relevant emergency powers available to NYCHA by New York City and New York State Commitment of additional financial resources from New York City and New York State for remediation and future sustainability
• A sustainable commitment to decent, safe and sanitary affordable housing using all tools available
• Setting specific performance targets for lead, mold, elevator, heat and vermin issues
• Robust oversight to assure remediation objectives are met
• Milestones for measuring meaningful progress toward remediation goals and other institutional improvements at NYCHA
• Reduction of unwarranted costs and elimination of bureaucratic impediments to efficient operations
• Management of the highest quality and commitment
• Local control of day-to-day operations by NYCHA and New York City
• Strong remedies that are immediately available to address any future failure to perform, whether in the case of individuals or organizational structures
• Commitment of all relevant emergency powers available to NYCHA by New York City and New York State
• Commitment of additional financial resources from New York City and New York State for remediation and future sustainability
""This is a very positive outcome, one that I believe can bring meaningful change to living conditions of the many thousands of families who depend upon NYCHA for their housing,"" said Secretary Carson. ""But there is still a lot of work to be carried out. We look forward to continuing what has been a productive working relationship with the Mayor and his team. HUD will continue to advocate for the hundreds of thousands of children, women and men in New York City whose lives and livelihoods depend on having safe, fair and affordable housing. They deserve nothing less."""
01/31/2019:,https://archives.hud.gov//news/2019/pr19-005.cfm,HUD and Census Bureau Report New Residential Sales in November 2018,"WASHINGTON - The U.S. Department of Housing and Urban Development (HUD) and the U.S. Census Bureau jointly announced the following new residential sales statistics for November 2018:

New Home Sales
Sales of new single-family houses in November 2018 were at a seasonally adjusted annual rate of 657,000. This is 16.9 percent (±19.9 percent)* above the revised October rate of 562,000 and is 7.7 percent (±20.7 percent)* below the November 2017 estimate of 712,000.
Sales Price
The median sales price of new houses sold in November 2018 was $302,400. The average sales price was $362,400.
For Sale Inventory and Months' Supply
The seasonally adjusted estimate of new houses for sale at the end of November was 330,000. This represents a supply of 6.0 months at the current sales rate.
Read more about new residential sales activity (www.census.gov/construction/nrs/index.html).
EXPLANATORY NOTES
In interpreting changes in the statistics in this release, note that month-to-month changes in seasonally adjusted statistics often show movements which may be irregular. It may take three months to establish an underlying trend for building permit authorizations, six months for total starts, and six months for total completions. The statistics in this release are estimated from sample surveys and are subject to sampling variability as well as nonsampling error including bias and variance from response, nonreporting, and undercoverage. Estimated relative standard errors of the most recent data are shown in the tables. Whenever a statement such as ""2.5 percent (±3.2 percent) above"" appears in the text, this indicates the range (-0.7 to +5.7 percent) in which the actual percentage change is likely to have occurred. All ranges given for percentage changes are 90 percent confidence intervals and account only for sampling variability. If a range does not contain zero, the change is statistically significant. If it does contain zero, the change is not statistically significant; that is, it is uncertain whether there was an increase or decrease. The same policies apply to the confidence intervals for percentage changes shown in the tables. On average, the preliminary seasonally adjusted estimates of total building permits, housing starts and housing completions are revised 3 percent or less. Explanations of confidence intervals and sampling variability can be found at the Census Bureau's website (www.census.gov/construction/nrs/how_the_data_are_collected/index.html).
* The 90 percent confidence interval includes zero. In such cases, there is insufficient statistical evidence to conclude that the actual change is different from zero."
